"Estamento","Grado","Titulo.Oficio","Funcion.Cargo","Unidad","BrutoHaber"
"ACADEMICOS","4","DOCTOR EN CIENCIAS MENCION FISICA","DIR DEPARTAMENTO DE FISICA","DEPARTAMENTO DE FISICA",4309046
"PROFESOR HORAS CLASES","S/G","ANTROPOLOGO","HORAS CLASE","FACULTAD DE CIENCIAS MEDICAS",161283
"PROFESOR HORAS CLASES","S/G","MAGISTER EN EDUCACION CON MENCION EN GESTION EDUCACIONAL","HORAS CLASE","DPTO LINGUISTICA Y LITERATURA",191994
"ACADEMICOS","4","DOCTOR OF PHILOSOPHY","ACADEMICO","DPTO. DE INVEST. CIENTIFICA",3086540
"PROFESOR HORAS CLASES","S/G","INGENIERO CIVIL EN INFORMATICA","HORAS CLASE","DPTO INGENIERIA INFORMATICA",512557
"ACADEMICOS","6","DOCTOR EN QUIMICA","ACADEMICO","DPTO. CIENCIAS DEL AMBIENTE",2640785
"PROFESIONALES","10","INGENIERO COMERCIAL","ENCARGO DE CONTROL Y GESTION","DEPTO. DE FINANZAS Y TESORERIA",1491171
"PROFESIONALES","13","ANALISTA EN POLITICAS Y ASUNTOS INTERNACIONALES","ANALISTA","FACULTAD DE HUMANIDADES",1215225
"ADMINISTRATIVO","13","SECRETARIA DE VICEDECANATO","SECRETARIA DE VICEDECANATO","FACULTAD DE QUIMICA Y BIOLOGIA",851015
"PROFESOR HORAS CLASES","S/G","ANALISTA EN POLITICAS Y ASUNTOS INTERNACIONALES","ANALISTA","DEPTO DE HISTORIA",192726
"PROFESIONALES","8","PROFESOR DE EDUCACION MEDIA EN HISTORIA Y GEOGRAFIA","ANALISTA DE PROYECTOS","CITECAMP",1755192
"PROFESOR HORAS CLASES","S/G","MAGISTER EN ADMINISTRACION Y DIRECCION DE EMPRESAS","HORAS CLASE","DPTO  INGENIERIA INDUSTRIAL",777890
"AUXILIARES","23","AUXILIAR","AUXILIAR","UNIDAD DE GESTION DEL CAMPUS",490153
"PROFESOR HORAS CLASES","S/G","PROFESOR DE INGLES","HORAS CLASE","DPTO LINGUISTICA Y LITERATURA",99337
"PROFESOR HORAS CLASES","S/G","PROFESOR DE ESTADO EN MATEMATICA Y COMPUTACION","HORAS CLASE","DPTO MAT. Y CS. DE LA COMP.",623648
"PROFESOR HORAS CLASES","S/G","PROFESOR DE ESTADO EN MATEMATICA Y COMPUTACION","HORAS CLASE","DPTO MAT. Y CS. DE LA COMP.",616967
"ACADEMICOS","4","DOCTOR EN CIENCIAS DE LA EDUCACION","ACADEMICO","VICERRECTORIA ACADÉMICA",3086540
"ACADEMICOS","4","DOCTOR OF PHILOSOPHY","ACADEMICO","DPTO. DE INVEST. CIENTIFICA",1553140
"PROFESOR HORAS CLASES","S/G","MAGISTER EN PSICOLOGIA SOCIAL","HORAS CLASE","ESCUELA DE PSICOLOGIA",142378
"PROFESOR HORAS CLASES","S/G","MAGISTER EN PSICOLOGIA SOCIAL","HORAS CLASE","ESCUELA DE PSICOLOGIA",291436
"PROFESOR HORAS CLASES","S/G","INGENIERO(A) DE EJECUCION EN ELECTRICIDAD","HORAS CLASE","DPTO INGENIERIA ELECTRICA",462725
"PROFESOR HORAS CLASES","S/G","INGENIERO(A) DE EJECUCION EN ELECTRICIDAD","HORAS CLASE","DPTO INGENIERIA ELECTRICA",154242
"PROFESOR HORAS CLASES","S/G","INGENIERO(A) DE EJECUCION EN ELECTRICIDAD","HORAS CLASE","DPTO INGENIERIA ELECTRICA",315166
"PROFESOR HORAS CLASES","S/G","INGENIERO(A) DE EJECUCION EN ELECTRICIDAD","HORAS CLASE","DPTO INGENIERIA ELECTRICA",308485
