"Estamento","Grado","Titulo.Oficio","Funcion.Cargo","Unidad","BrutoHaber"
"PROFESIONALES","10","MAGISTER EN GESTION CULTURAL APLICADA: POLITICAS Y GESTION DE INSTITUCIONES CULTURALES","JEFE DE SECCION","UNIDAD DE VOCACION ARTISTICA",776687
"PROFESIONALES","10","SOCIOLOGO","ANALISTA DE GESTION I","DIR.  DESARROLLO INSTITUCIONAL",1475252
"PROFESIONALES","12","INGENIERO DE EJECUCION EN TEXTIL","ENCARGADO DE LABORATORIO","DPTO INGENIERIA QUIMICA",724284
"ADMINISTRATIVO","20","ADMINISTRATIVO DE APOYO","ADMINISTRATIVO DE APOYO","DPTO. PLANFIC Y PRESUPUESTARIA",587764
"PROFESOR HORAS CLASES","S/G","MAGISTER EN GESTION CULTURAL APLICADA: POLITICAS Y GESTION DE INSTITUCIONES CULTURALES","JEFE DE SECCION","UNIDAD DE VOCACION ARTISTICA",1044099
"PROFESOR HORAS CLASES","S/G","MAGISTER EN HISTORIA EN LA MENCION DE HISTORIA DE CHILE","HORAS CLASE","DEPTO DE HISTORIA",253469
"PROFESOR HORAS CLASES","S/G","HORAS CLASE","HORAS CLASE","DPTO INGENIERIA INFORMATICA",220828
"PROFESOR HORAS CLASES","S/G","HORAS CLASE","HORAS CLASE","DPTO INGENIERIA QUIMICA",401961
"PROFESOR HORAS CLASES","S/G","INGENIERO COMERCIAL","HORAS CLASE","DPTO CIENCIA Y TEC.DE LOS ALIM",258448
"PROFESOR HORAS CLASES","S/G","INGENIERO COMERCIAL","HORAS CLASE","DPTO  INGENIERIA INDUSTRIAL",628832
"PROFESOR HORAS CLASES","S/G","INGENIERO CIVIL EN MINAS","HORAS CLASE","DPTO INGENIERIA EN MINAS",253469
"PROFESOR HORAS CLASES","S/G","DOCTOR EN GEOGRAFIA. PLANIFICACION TERRITORIAL Y GESTION AMBIENTAL","HORAS CLASE","PROGRAMA BACHILLERATO",652562
"PROFESOR HORAS CLASES","S/G","HORAS CLASE","HORAS CLASE","DPTO  INGENIERIA INDUSTRIAL",247858
"PROFESOR HORAS CLASES","S/G","MAGISTER EN LINGÜÍSTICA MENCION SOCIOLINGUISTICA HISPONOAMERICANA","HORAS CLASE","DPTO LINGUISTICA Y LITERATURA",206819
"ACADEMICOS","6","ADMINISTRADOR PUBLICO","JEFE DE CARRERA ADM. PUBLICA","DPTO. GESTION Y POLITICAS PUB.",2997910
"PROFESOR HORAS CLASES","S/G","PROFESOR DE INGLES","HORAS CLASE","DPTO. GESTION Y POLITICAS PUB.",280009
"PROFESOR HORAS CLASES","S/G","PUBLICISTA","HORAS CLASE","DEPTO. DE PUBLICIDAD E IMAGEN",238556
"PROFESOR HORAS CLASES","S/G","DOCTOR EN GEOGRAFIA. PLANIFICACION TERRITORIAL Y GESTION AMBIENTAL","HORAS CLASE","PROGRAMA BACHILLERATO",398217
"PROFESOR HORAS CLASES","S/G","HORAS CLASE","HORAS CLASE","DPTO LINGUISTICA Y LITERATURA",429197
"PROFESOR HORAS CLASES","S/G","PROFESOR DE INGLES","HORAS CLASE","DPTO. GESTION Y POLITICAS PUB.",286690
"ACADEMICOS","6","MASTER UNIVERSITARIO DI I LIVELLO IN DESIGN PER LO SVILUPPO DEL PRODOTTO INDUSTRIALE","ACADEMICO","DPTO. TECNOLOGIAS GENERALES",2622706
"PROFESIONALES","6","INGENIERO CIVIL EN INFORMATICA","PROFESIONAL","UNIDAD REGIST. ACAD Y CURRICUL",2188661
"PROFESIONALES","10","INGENIERO DE EJECUCION EN MINAS","RESPONSABLE TEC TEMP Y PRESION","DPTO INGENIERIA ELECTRICA",1491171
"ADMINISTRATIVO","15","SECRETARIA DE APOYO DOCENTE","SECRETARIA DE APOYO DOCENTE","DPTO MAT. Y CS. DE LA COMP.",846008
"AUXILIARES","21","MAYORDOMO","MAYORDOMO","CENTRO FELIX KLEIN",541881
"PROFESIONALES","10","PERIODISTA","PROFESIONAL","DEPARTAMENTO DE COMUNICACIONES",1475252
"ADMINISTRATIVO","17","SECRETARIA DE DIRECCION","SECRETARIA DE DIRECCION","DIRECCIÓN DE POSTGRADO",609800
"PROFESIONALES","10","CONTADOR PUBLICO Y AUDITOR","AUDITOR I","CONTRALORIA UNIVERSITARIA",1475252
"ADMINISTRATIVO","18","ADMINISTRATIVO DE REGISTRO CUR","ADMINISTRATIVO DE REGISTRO CUR","FACULTAD DE ADMINIST Y ECONOMI",629392
"AUXILIARES","19","AUXILIAR DE SERVICIOS","AUXILIAR DE SERVICIOS","INSTITUTO DE ESTUDIOS AVANZADO",601224
"PROFESOR HORAS CLASES","S/G","INGENIERO CIVIL EN INFORMATICA","PROFESIONAL","DPTO MAT. Y CS. DE LA COMP.",560016
"PROFESOR HORAS CLASES","S/G","INGENIERO CIVIL EN INFORMATICA","PROFESIONAL","DPTO MAT. Y CS. DE LA COMP.",146686
"PROFESOR HORAS CLASES","S/G","INGENIERO CIVIL EN INFORMATICA","PROFESIONAL","DPTO MAT. Y CS. DE LA COMP.",140005
"PROFESOR HORAS CLASES","S/G","ADMINISTRADOR PUBLICO","HORAS CLASE","DPTO. GESTION Y POLITICAS PUB.",109636
"AUXILIARES","21","MAYORDOMO","MAYORDOMO","FACULTAD DE CIENCIAS MEDICAS",559812
"PROFESIONALES","14","BIBLIOTECARIO DOCUMENTALISTA","BIBLIOTECARIO","FACULTAD DE HUMANIDADES",1160601
"PROFESIONALES","8","ABOGADO(A)","ABOGADO","CONTRALORIA UNIVERSITARIA",1940675
"PROFESOR HORAS CLASES","S/G","PSICOLOGO","HORAS CLASE","DPTO. TECNOLOGIAS GENERALES",253469
"PROFESOR HORAS CLASES","S/G","PUBLICISTA","HORAS CLASE","DEPTO. DE PUBLICIDAD E IMAGEN",528730
"ACADEMICOS","4","DOCTOR OF PHILOSOPHY IN TECHNICAL SCIENCES","ACADEMICO","DPTO INGENIERIA METALURGICA",3192097
"ADMINISTRATIVO","17","SECRETARIA DE DIRECCION","SECRETARIA DE DIRECCION","DPTO INGENIERIA METALURGICA",605004
"ACADEMICOS","4","DOCTOR EN MICROBIOLOGIA","ACADEMICO","DEPARTAMENTO DE BIOLOGIA",3107652
"ADMINISTRATIVO","12","ADMINISTRATIVO ESPECIALES","ADMINISTRATIVO ESPECIALES","DEPTO. BENEFICIOS ESTUDIANTILE",912124
"TECNICO","18","TECNICO EN BIBLIOTECAS","TECNICO EN BIBLIOTECAS","UNIDAD DE BIBLIOTECAS",596067
"AUXILIARES","21","ESTAFETA","ESTAFETA","ESCUELA DE MEDICINA",651293
"PROFESIONALES","10","INGENIERO FISICO","ANALISTA DE GESTION I","DIRECCIÓN DE POSTGRADO",1475252
"ADMINISTRATIVO","15","SECRETARIO B","SECRETARIO B","DPTO INGENIERIA QUIMICA",722228
"ADMINISTRATIVO","17","ADMINISTRATIVO DE APOYO","ADMINISTRATIVO DE APOYO","DPTO MAT. Y CS. DE LA COMP.",605004
"PROFESIONALES","6","PSICOLOGO CLINICO","PSICOLOGO CLINICO","ESCUELA DE PSICOLOGIA",577345
"PROFESOR HORAS CLASES","S/G","ENFERMERA","HORAS CLASE","ESCUELA DE ENFERMERIA",711662
"PROFESOR HORAS CLASES","S/G","PROFESOR DE ESPAÑOL","HORAS CLASE","DPTO LINGUISTICA Y LITERATURA",191994
"PROFESOR HORAS CLASES","S/G","INGENIERO CIVIL DE INDUSTRIAS","HORAS CLASE","DPTO. TECNOLOGIAS INDUSTRIALES",243977
"PROFESOR HORAS CLASES","S/G","PROFESOR DE INGLES","HORAS CLASE","DPTO LINGUISTICA Y LITERATURA",807236
"ACADEMICOS","4","DOCTOR EN CIENCIAS CON MENCION EN FISICA","ACADEMICO","DEPARTAMENTO DE FISICA",3107652
"TECNICO","20","TECNICO","TECNICO","FACULTAD DE QUIMICA Y BIOLOGIA",689668
"ADMINISTRATIVO","15","SECRETARIA EJECUTIVA GERENCIAL","SECRETARIA ADMINISTRATIVA","DEPARTAMENTO DE EDUCACIÓN",709881
"ADMINISTRATIVO","12","ADMINISTRATIVO UNICIT","ADMINISTRATIVO UNICIT","UNIDAD DE PROYECTO UNICYT",721162
"PROFESIONALES","8","INGENIERÍA DE EJECUCIÓN AGRÍCOLA CON MENCIÓN EN GANADERÍA","ANALISTA GEST. II COORD UNICIT","UNIDAD DE PROYECTO UNICYT",1701190
"PROFESOR HORAS CLASES","S/G","ADMINISTRADOR PUBLICO","HORAS CLASE","DPTO. GESTION Y POLITICAS PUB.",469965
"PROFESOR HORAS CLASES","S/G","MAGISTER EN HISTORIA","HORAS CLASE","DEPTO DE HISTORIA",490763
"PROFESOR HORAS CLASES","S/G","MAGISTER EN ADMINISTRACION Y DIRECCION DE RRHH.","HORAS CLASE","PROGRAMA BACHILLERATO",448049
"PROFESOR HORAS CLASES","S/G","HORAS CLASE","HORAS CLASE","DPTO MAT. Y CS. DE LA COMP.",955862
"ADMINISTRATIVO","17","ADMINISTRATIVO REMUNERACIONES","ADMINISTRATIVO REMUNERACIONES","DPTO. DE RECURSOS HUMANOS",605004
"ADMINISTRATIVO","17","OPERADOR DE CALDERA","OPERADOR DE CALDERA","DEPARTAMENTO DE DEPORTES",815719
"ADMINISTRATIVO","17","SECRETARIA DE APOYO DOCENTE","SECRETARIA DE APOYO DOCENTE","ESCUELA DE MEDICINA",616506
"PROFESIONALES","8","TECNOLOGO EN ADMINISTRACION DE PERSONAL","JEFE DE SECCION","DEPTO. DESARROLLO DE PERSONAS",1827194
"PROFESOR HORAS CLASES","S/G","HORAS CLASE","HORAS CLASE","DPTO LINGUISTICA Y LITERATURA",955862
"AUXILIARES","23","AUXILIAR","AUXILIAR","UNIDAD DE GESTION DEL CAMPUS",490153
"PROFESOR HORAS CLASES","S/G","TERAPEUTA OCUPACIONAL","HORAS CLASE","FACULTAD DE CIENCIAS MEDICAS",161283
"PROFESIONALES","13","MEDICO VETERINARIO","ANALISTA GEST. II COORD UNICIT","UNIDAD DE PROYECTO UNICYT",1188565
"ADMINISTRATIVO","16","ADMINISTRATIVO DE PROCESO","ADMINISTRATIVO DE PROCESO","UNIDAD DE PROYECTO UNICYT",637683
"ACADEMICOS","6","MAGISTER EN NEUROCIENCIA","ACADEMICO","VICERRECTORIA ACADÉMICA",2550387
"PROFESOR HORAS CLASES","S/G","INGENIERO CIVIL","HORAS CLASE","DPTO INGENIERIA OBRAS CIVILES",191994
"PROFESOR HORAS CLASES","S/G","PROFESOR DE ESTADO EN MATEMATICA Y COMPUTACION","HORAS CLASE","DPTO MAT. Y CS. DE LA COMP.",448049
"AUXILIARES","21","MAYORDOMO","MAYORDOMO","ESCUELA DE ARQUITECTURA",529318
"TECNICO","19","AUXILIAR DE SERVICIOS","AUXILIAR DE SERVICIOS","DEPTO DE CALIDAD VIDA ESTUDIAN",769109
"PROFESIONALES","8","PROFESOR DE EDUCACION MEDIA EN FISICA Y CIENCIAS NATURALES","PROFESIONAL","DIRECCIÓN CALIDAD Y SISTEMAS",1912892
"PROFESIONALES","8","TECNOLOGO EN ADMINISTRACION DE PERSONAL","JEFE DE AREA","UNIDAD DE ADQUISICIONES",1737191
"PROFESIONALES","14","INGENIERO DE EJECUCION EN INDUSTRIA","ANALISTA DE PROYECTOS","DPTO DE GESTIÓN DE LA INFRAEST",1147781
"ADMINISTRATIVO","15","SECRETARIA ADMINISTRATIVA","SECRETARIA ADMINISTRATIVA","DEPARTAMENTO DE EDUCACIÓN",833661
"PROFESOR HORAS CLASES","S/G","PROFESOR DE EDUCACION MEDIA EN FISICA Y CIENCIAS NATURALES","PROFESIONAL","DPTO. TECNOLOGIAS INDUSTRIALES",546675
"PROFESIONALES","5","INGENIERO COMERCIAL EN ADMINISTRACION DE EMPRESAS","ANALISTA DE LA CALIDAD","DIRECCIÓN CALIDAD Y SISTEMAS",2283075
"TECNICO","17","TECNICO","TECNICO","ESCUELA DE MEDICINA",605004
"PROFESOR HORAS CLASES","S/G","HORAS CLASE","HORAS CLASE","DPTO MAT. Y CS. DE LA COMP.",974846
"PROFESOR HORAS CLASES","S/G","ESPECIALISTA EN PSIQUIATRIA","HORAS CLASE","ESCUELA DE MEDICINA",257134
"PROFESIONALES","10","TECNOLOGO EN CONTROL INDUSTRIAL","ANALISTA DE LA CALIDAD","DIRECCIÓN CALIDAD Y SISTEMAS",1491171
"PROFESIONALES","14","PROFESOR DE ESTADO EN MATEMATICA Y COMPUTACION","ENCARGADO DE LABORATORIO","DPTO  INGENIERIA INDUSTRIAL",1376964
"ACADEMICOS","2","DOCTOR EN  CIENCIAS DE LA INGENIERIA MENCION CIENCIAS DE LOS MATERIALES","ACADEMICO","DPTO INGENIERIA METALURGICA",3907440
"ACADEMICOS","4","MASTER OF ENGINEERING","ACADEMICO","DPTO INGENIERIA EN MINAS",3382099
"TECNICO","19","ASISTENTE DE LABORATORIO","ASISTENTE DE LABORATORIO","CEUS LLANQUIHUE USACH",611968
"AUXILIARES","22","ESTAFETA","ESTAFETA","DPTO LINGUISTICA Y LITERATURA",534597
"PROFESOR HORAS CLASES","S/G","DISEÑADOR(A) INDUSTRIAL","HORAS CLASE","DPTO. TECNOLOGIAS GENERALES",837214
"PROFESOR HORAS CLASES","S/G","INGENIERO DE EJECUCION EN PREVENCION DE RIESGOS","HORAS CLASE","DPTO. TECNOLOGIAS INDUSTRIALES",718566
"PROFESOR HORAS CLASES","S/G","MEDICO CIRUJANO","HORAS CLASE","ESCUELA DE MEDICINA",526485
"PROFESOR HORAS CLASES","S/G","HORAS CLASE","HORAS CLASE","DEPARTAMENTO DE EDUCACIÓN",562622
"PROFESIONALES","12","INGENIERO DE EJECUCION EN AMBIENTE","ENCARGADO DE LABORATORIO","DPTO INGENIERIA GEOGRAFICA",1450042
"ADMINISTRATIVO","17","INGENIERO EN ADMINISTRACION DE EMPRESAS CON MENCION FINANZAS","ADMINISTRATIVO DE RECURSOS HUM","DPTO. DE RECURSOS HUMANOS",593503
"ACADEMICOS","4","DOCTORIS PHILOSOPHIAE GRADVM","VICEDECANO INVEST FAC DE HUMAN","DEPARTAMENTO DE FILOSOFÍA",4224601
"ACADEMICOS","6","QUIMICO FARMACEUTICO","ACADEMICO","VICERRECTORIA ACADÉMICA",2532307
"PROFESOR HORAS CLASES","S/G","ADMINISTRADOR DE INDUSTRIAS","HORAS CLASE","DPTO. TECNOLOGIAS GENERALES",614156
"PROFESOR HORAS CLASES","S/G","ADMINISTRADOR DE INDUSTRIAS","HORAS CLASE","DPTO. TECNOLOGIAS GENERALES",303739
"PROFESOR HORAS CLASES","S/G","ADMINISTRADOR DE INDUSTRIAS","HORAS CLASE","DPTO INGENIERIA EN MINAS",303739
"PROFESOR HORAS CLASES","S/G","HORAS CLASE","HORAS CLASE","ESCUELA DE PERIODISMO",509746
"ADMINISTRATIVO","12","ADMINISTRACION DE EMPRESAS. MENCION PERSONAL","ENCARGADO(A) ADM CENTRO_COSTOS","SECRETARIA GENERAL",791795
"PROFESOR HORAS CLASES","S/G","EDUCADORA DE PARVULOS","HORAS CLASE","DEPARTAMENTO DE EDUCACIÓN",139567
"PROFESOR HORAS CLASES","S/G","MAGISTER EN PROCESAMIENTO Y GESTION DE LA INFORMACION","HORAS CLASE","DPTO INGENIERIA INFORMATICA",295770
"PROFESOR HORAS CLASES","S/G","EDUCADORA DE PARVULOS","HORAS CLASE","DEPARTAMENTO DE EDUCACIÓN",132886
"PROFESOR HORAS CLASES","S/G","MAGISTER EN EDUCACION CON MENCION EN ORIENTACION","HORAS CLASE","DEPARTAMENTO DE EDUCACIÓN",946808
"PROFESOR HORAS CLASES","S/G","PERIODISTA","HORAS CLASE","ESCUELA DE PERIODISMO",191994
"PROFESOR HORAS CLASES","S/G","EDUCADORA DE PARVULOS","HORAS CLASE","DEPARTAMENTO DE EDUCACIÓN",199328
"PROFESOR HORAS CLASES","S/G","HORAS CLASE","HORAS CLASE","DEPARTAMENTO DE FISICA",747041
"PROFESOR HORAS CLASES","S/G","MAGISTER EN EDUCACION CON MENCION EN ORIENTACION","HORAS CLASE","DEPARTAMENTO DE EDUCACIÓN",141940
"ADMINISTRATIVO","17","TECNOLOGO EN ADMINISTRACION DE PERSONAL","ADMINISTRATIVO DE REGISTRO CUR","FACULTAD DE HUMANIDADES",674012
"PROFESIONALES","14","TECNOLOGO EN ADMINISTRACION DE PERSONAL","ANALISTA EN GESTION ADM.","FACULTAD DE CIENCIA",1312862
"TECNICO","20","AYUDANTE MAESTRO DE COCINA","AYUDANTE MAESTRO DE COCINA","UNIDAD ADM. SERV. ALIMENTARIOS",592800
"ADMINISTRATIVO","14","ADMINISTRATIVO","ADMINISTRATIVO","DIRECCIÓN DE POSTGRADO",694317
"PROFESIONALES","8","TECNICO UNIVERSITARIO EN ADMINISTRACION DE MATERIALES","CAJERO SON PAGO","FACULTAD DE CIENCIA",1957278
"PROFESOR HORAS CLASES","S/G","MAGISTER EN LETRAS CON MENCION EN LINGUISTICA","HORAS CLASE","DPTO LINGUISTICA Y LITERATURA",1031796
"PROFESIONALES","9","MAGISTER EN ECONOMIA FINANCIERA","JEFE DE LABORATORIO","DPTO INGENIERIA OBRAS CIVILES",1796516
"TECNICO","17","FOTOGRAFIA PUBLICITARIA","FOTOGRAFO","DEPARTAMENTO DE COMUNICACIONES",746712
"AUXILIARES","21","AUXILIAR DE SERVICIOS","AUXILIAR DE SERVICIOS","CECTA",731483
"PROFESIONALES","9","TECNOLOGO EN CONTROL INDUSTRIAL","ANALISTA DE GESTION DE PERSONA","DEPTO. DESARROLLO DE PERSONAS",1661214
"PROFESOR HORAS CLASES","S/G","MAGISTER EN ECONOMIA FINANCIERA","JEFE DE LABORATORIO","DPTO  INGENIERIA INDUSTRIAL",911213
"PROFESOR HORAS CLASES","S/G","ADMINISTRADOR PUBLICO","HORAS CLASE","DPTO. TECNOLOGIAS GENERALES",528730
"PROFESOR HORAS CLASES","S/G","HORAS CLASE","HORAS CLASE","FACULTAD DE CIENCIAS MEDICAS",264069
"PROFESOR HORAS CLASES","S/G","PROFESOR DE EDUCACION MEDIA EN HISTORIA Y GEOGRAFIA","HORAS CLASE","DEPARTAMENTO DE EDUCACIÓN",81938
"PROFESOR HORAS CLASES","S/G","PROFESOR DE EDUCACION MEDIA EN HISTORIA Y GEOGRAFIA","HORAS CLASE","DEPARTAMENTO DE EDUCACIÓN",252496
"TECNICO","20","CHOFER","CHOFER","UNIDAD DE GESTION DEL CAMPUS",608752
"ADMINISTRATIVO","16","SECRETARIADO EJECUTIVO COMPUTACIONAL","SECRETARIA DE APOYO DOCENTE","ESCUELA DE MEDICINA",661500
"ADMINISTRATIVO","17","ANALISTA CONTABLE","ANALISTA CONTABLE","DEPTO. DE FINANZAS Y TESORERIA",769714
"ACADEMICOS","8","ABOGADO(A)","ACADEMICO","FACULTAD DE DERECHO",522642
"PROFESOR HORAS CLASES","S/G","HORAS CLASE","HORAS CLASE","DPTO. GESTION Y POLITICAS PUB.",762761
"ACADEMICOS","6","DOCTOR EN QUIMICA","ACADEMICO","DPTO. QUIMICA DE LOS MATERIALE",2622706
"ACADEMICOS","4","MEDICO CIRUJANO","ACADEMICO","ESCUELA DE MEDICINA",2342422
"PROFESOR HORAS CLASES","S/G","INGENIERO CIVIL EN OBRAS CIVILES","HORAS CLASE","DPTO INGENIERIA OBRAS CIVILES",391098
"PROFESOR HORAS CLASES","S/G","INGENIERO DE EJECUCION EN GEOMENSURA","HORAS CLASE","DPTO INGENIERIA GEOGRAFICA",284651
"PROFESIONALES","8","INGENIERO DE EJECUCION EN COMPUTACION E INFORMATICA","ANALISTA INFORMATICO","FACULTAD DE INGENIERÍA",1912892
"PROFESOR HORAS CLASES","S/G","INGENIERO DE EJECUCION EN CLIMATIZACION","HORAS CLASE","DPTO INGENIERIA MECANICA",60218
"PROFESIONALES","9","INGENIERO DE EJECUCION EN ADMINISTRACION DE EMPRESAS","PROFESIONAL","VR INVEST. DESARR E INNOVACION",1812388
"PROFESOR HORAS CLASES","S/G","MAGISTER EN EDUCACION CON MENCION EN CURRICULUM Y EVALUACION","HORAS CLASE","DEPARTAMENTO DE EDUCACIÓN",423636
"PROFESOR HORAS CLASES","S/G","PROFESOR DE ESTADO EN CASTELLANO","HORAS CLASE","DPTO LINGUISTICA Y LITERATURA",199407
"PROFESOR HORAS CLASES","S/G","HORAS CLASE","HORAS CLASE","ESCUELA DE ARQUITECTURA",103043
"PROFESOR HORAS CLASES","S/G","PROFESOR DE ESTADO EN CASTELLANO","HORAS CLASE","DPTO LINGUISTICA Y LITERATURA",289089
"ACADEMICOS","6","ENFERMERA","ACADEMICO","ESCUELA DE ENFERMERIA",2640785
"PROFESOR HORAS CLASES","S/G","HORAS CLASE","HORAS CLASE","DPTO MAT. Y CS. DE LA COMP.",268593
"PROFESOR HORAS CLASES","S/G","MAGISTER EN PSICOLOGIA","HORAS CLASE","ESCUELA DE PSICOLOGIA",243977
"ADMINISTRATIVO","17","SECRETARIA DE APOYO DOCENTE","SECRETARIA DE APOYO DOCENTE","DPTO LINGUISTICA Y LITERATURA",593503
"PROFESIONALES","8","SOCIOLOGO","COORDINADOR DE PROYECTOS","CENTRO DE INTEGR ING SOCIEDAD",1718700
"PROFESOR HORAS CLASES","S/G","DOCTOR EN EDUCACION FISICA","HORAS CLASE","CARRERA LICEN CS. ACTIV. FISIC",855010
"PROFESOR HORAS CLASES","S/G","INGENIERO COMERCIAL EN ECONOMIA","HORAS CLASE","DPTO DE ECONOMIA",109636
"PROFESOR HORAS CLASES","S/G","HORAS CLASE","HORAS CLASE","DPTO MAT. Y CS. DE LA COMP.",261026
"PROFESOR HORAS CLASES","S/G","HORAS CLASE","HORAS CLASE","DPTO MAT. Y CS. DE LA COMP.",789755
"PROFESOR HORAS CLASES","S/G","INGENIERO(A) DE EJECUCION EN ELECTRICIDAD","HORAS CLASE","DPTO. TECNOLOGIAS INDUSTRIALES",1202649
"ADMINISTRATIVO","16","ADMINISTRATIVO CONTABLE","ADMINISTRATIVO CONTABLE","ADM.GRAL. FONDO SOLIDARIO CRED",685317
"PROFESIONALES","13","DIRECTOR CORO USACH","DIRECTOR CORO USACH","DEPARTAMENTO DE EXTENSION",1201895
"PROFESIONALES","14","TECNOLOGO EN CONTROL INDUSTRIAL","ANALISTA","UNIDAD DE ADQUISICIONES",1147781
"AUXILIARES","21","AUXILIAR DE SERVICIOS","AUXILIAR DE SERVICIOS","VR. DE APOYO AL ESTUDIANTE",506896
"TECNICO","17","TECNICO","TECNICO","UNIDAD DE GESTION DEL CAMPUS",605004
"ACADEMICOS","4","DOCTOR EN ESTUDIOS SOCIALES DE LA CIENCIA Y LA TECNOLOGIA","ACADEMICO","INSTITUTO DE ESTUDIOS AVANZADO",3170986
"PROFESOR HORAS CLASES","S/G","INGENIERO CIVIL DE INDUSTRIAL","HORAS CLASE","DPTO  INGENIERIA INDUSTRIAL",562622
"PROFESOR HORAS CLASES","S/G","PROFESOR DE MATEMATICAS","HORAS CLASE","DPTO MAT. Y CS. DE LA COMP.",1240616
"PROFESOR HORAS CLASES","S/G","DOCTOR EN MEDICINA Y CIRUGIA","HORAS CLASE","ESCUELA DE MEDICINA",465845
"PROFESOR HORAS CLASES","S/G","MATRON (A)","ACADEMICO","ESCUELA DE OBST Y PUERICULTURA",442158
"ACADEMICOS","6","MATRON (A)","ACADEMICO","VICERRECTORIA ACADÉMICA",1283494
"ACADEMICOS","6","DOCTOR EN CIENCIAS APLICADAS EN LA OPCION DE NANOCIENCIAS Y NANOTECNOLOGIAS","ACADEMICO","DEPARTAMENTO DE FISICA",2604626
"PROFESOR HORAS CLASES","S/G","PROFESOR DE ESTADO EN MATEMATICA Y COMPUTACION","HORAS CLASE","DPTO MAT. Y CS. DE LA COMP.",1012813
"ACADEMICOS","6","DOCTOR EN FÍSICA","ACADEMICO","DEPARTAMENTO DE FISICA",2640785
"ADMINISTRATIVO","12","SECRETARIA ADMINISTRATIVA","SECRETARIA ADMINISTRATIVA","DPTO  INGENIERIA INDUSTRIAL",805921
"ACADEMICOS","4","MEDICO CIRUJANO","ACADEMICO","ESCUELA DE MEDICINA",1563080
"ACADEMICOS","6","DOCTOR EN FARMACOLOGIA","ACADEMICO","DPTO. DE INVEST. CIENTIFICA",2568466
"PROFESOR HORAS CLASES","S/G","HORAS CLASE","HORAS CLASE","DPTO INGENIERIA EN MINAS",161113
"PROFESOR HORAS CLASES","S/G","PSICOLOGO","HORAS CLASE","UNIDAD PROMOCIÓN DE LA SALUD",163698
"PROFESOR HORAS CLASES","S/G","PSICOLOGO","HORAS CLASE","ESCUELA DE ENFERMERIA",170559
"PROFESOR HORAS CLASES","S/G","INGENIERO DE EJECUCION EN GEOMENSURA","HORAS CLASE","DPTO INGENIERIA GEOGRAFICA",58159
"ACADEMICOS","6","PSICOLOGO","DIRECTOR ESCUELA DE PSICOLOGIA","ESCUELA DE PSICOLOGIA",4205164
"PROFESOR HORAS CLASES","S/G","INGENIERO CIVIL","HORAS CLASE","DPTO  INGENIERIA INDUSTRIAL",130225
"PROFESIONALES","9","PROFESOR DE INGLES","JEFE DE SECCION","DPTO LINGUISTICA Y LITERATURA",1661214
"PROFESIONALES","12","RELACIONADOR PUBLICO","RELACIONADOR PUBLICO","DEPARTAMENTO DE COMUNICACIONES",1365283
"ADMINISTRATIVO","13","SECRETARIA DE DECANATO","SECRETARIA DE DECANATO","DPTO CONTABILIDAD Y AUDITOR",837685
"PROFESOR HORAS CLASES","S/G","PROFESOR DE INGLES","JEFE DE SECCION","DPTO LINGUISTICA Y LITERATURA",415103
"PROFESOR HORAS CLASES","S/G","MASTER EN DIRECCION DE ADMINISTRACION Y FINANZAS","HORAS CLASE","DPTO DE ADMINISTRACION",659243
"PROFESOR HORAS CLASES","S/G","MASTER EN DIRECCION DE ADMINISTRACION Y FINANZAS","HORAS CLASE","DPTO DE ADMINISTRACION",391536
"PROFESIONALES","13","BIBLIOTECOLOGO CON MENCION EN AUTOMATIZACION DE UNIDADES DE INFORMACION","ENCARGADO DE ARCHIVO CENTRAL","SECRETARIA GENERAL",1410304
"ACADEMICOS","6","ACADEMICO","ACADEMICO","DPTO. DE INVEST. CIENTIFICA",2532307
"PROFESOR HORAS CLASES","S/G","INGENIERO CIVIL MECANICO","HORAS CLASE","DPTO. TECNOLOGIAS INDUSTRIALES",1342896
"ACADEMICOS","6","ABOGADO(A)","ACADEMICO","FACULTAD DE DERECHO",636049
"PROFESOR HORAS CLASES","S/G","INGENIERO CIVIL MECANICO","HORAS CLASE","DPTO. TECNOLOGIAS INDUSTRIALES",445407
"ACADEMICOS","4","MAGISTER EN CIENCIAS MENCION COMPUTACION","ACADEMICO","DPTO MAT. Y CS. DE LA COMP.",3339876
"ACADEMICOS","4","MAGISTER EN HISTORIA","ACADEMICO","DPTO. GESTION Y POLITICAS PUB.",3128763
"PROFESOR HORAS CLASES","S/G","MAGISTER EN PEDAGOGIA UNIVERSITARIA","HORAS CLASE","DEPARTAMENTO DE BIOLOGIA",191994
"PROFESOR HORAS CLASES","S/G","HORAS CLASE","HORAS CLASE","UNIDAD PROMOCIÓN DE LA SALUD",101190
"PROFESIONALES","13","DOCTOR EN BIOTECNOLOGIA","HORAS CLASE","UNIDAD DE COORDINACIÓN INSTIT.",946966
"PROFESOR HORAS CLASES","S/G","MAGISTER EN ARTES. CON MENCION EN TEORIA E HISTORIA DEL ARTE","HORAS CLASE","DPTO. TECNOLOGIAS GENERALES",614156
"PROFESOR HORAS CLASES","S/G","DOCTOR EN BIOTECNOLOGIA","HORAS CLASE","DPTO. QUIMICA DE LOS MATERIALE",531541
"PROFESOR HORAS CLASES","S/G","DOCTOR EN BIOTECNOLOGIA","HORAS CLASE","DPTO. QUIMICA DE LOS MATERIALE",538222
"ADMINISTRATIVO","10","ADM ESPECIALIZADO EN PEOPLESOF","ADM ESPECIALIZADO EN PEOPLESOF","UNIDAD DESARR. PROYECTOS TECN.",874454
"PROFESIONALES","6","MAGISTER EN PSICOLOGIA SOCIAL APLICADA","ANALISTA DE PROYECTOS I","DPTO  INGENIERIA INDUSTRIAL",2154449
"PROFESOR HORAS CLASES","S/G","MAGISTER EN PSICOLOGIA SOCIAL APLICADA","ANALISTA DE PROYECTOS I","DPTO  INGENIERIA INDUSTRIAL",211257
"PROFESOR HORAS CLASES","S/G","MECANICA INDUSTRIAL","HORAS CLASE","DPTO. TECNOLOGIAS INDUSTRIALES",1012813
"ADMINISTRATIVO","20","ADMINISTRATIVO DE APOYO","ADMINISTRATIVO DE APOYO","FACULTAD DE DERECHO",545788
"PROFESIONALES","10","ANALISTA DE CALIDAD","ANALISTA DE CALIDAD","DIRECCIÓN CALIDAD Y SISTEMAS",1475252
"PROFESOR HORAS CLASES","S/G","INGENIERO CIVIL INDUSTRIAL","HORAS CLASE","DPTO  INGENIERIA INDUSTRIAL",59189
"PROFESOR HORAS CLASES","S/G","MASTER PRACTITIONER EN PROGRAMACION NEURO-LINGUISTICA","HORAS CLASE","DEPARTAMENTO DE EDUCACIÓN",1031796
"ADMINISTRATIVO","12","ASISTENTE DE LABORATORIO","ASISTENTE DE LABORATORIO","VR. VINCULACION CON EL MEDIO",940377
"PROFESIONALES","8","KINESIOLOGO(A)","ANALISTA GEST. II COORD UNICIT","UNIDAD DE PROYECTO UNICYT",1701190
"PROFESIONALES","13","PERIODISTA","PERIODISTA","DEPARTAMENTO DE COMUNICACIONES",1188565
"PROFESIONALES","13","BIOQUIMICO","ENCARGADO DE LABORATORIO","DEPARTAMENTO DE BIOLOGIA",600211
"PROFESOR HORAS CLASES","S/G","PROFESOR DE EDUCACION MEDIA EN FISICA Y CIENCIAS NATURALES","HORAS CLASE","DEPARTAMENTO DE FISICA",1031796
"ACADEMICOS","6","DOCTOR(A) EN ESTUDIOS AMERICANOS EN LA ESPECIALIDAD ESTUDIOS INTERNACIONALES","JEFE CARRER LIC LING APL TRADU","VICERRECTORIA ACADÉMICA",2889432
"PROFESIONALES","8","INGENIERO(A) DE EJECUCION EN ELECTRICIDAD","JEFE DE LABORATORIO","DPTO INGENIERIA ELECTRICA",1958099
"PROFESOR HORAS CLASES","S/G","INGENIERO(A) DE EJECUCION EN ELECTRICIDAD","JEFE DE LABORATORIO","DPTO INGENIERIA ELECTRICA",616967
"PROFESOR HORAS CLASES","S/G","INGENIERO(A) DE EJECUCION EN ELECTRICIDAD","JEFE DE LABORATORIO","DPTO INGENIERIA ELECTRICA",308485
"PROFESOR HORAS CLASES","S/G","KINESIOLOGO(A)","HORAS CLASE","FACULTAD DE CIENCIAS MEDICAS",161283
"PROFESIONALES","12","TECNOLOGO EN ADMINISTRACION DE PERSONAL","PROFESIONAL","UNIDAD DE ADQUISICIONES",1542118
"MEDICOS Y DENTISTAS","S/G","MEDICO CIRUJANO","MEDICO GINECOLOGO","CENTRO DE SALUD",366504
"TECNICO","18","TECNICO","TECNICO","DEPARTAMENTO DE EXTENSION",467599
"TECNICO","17","EJECUTIVO DE COBRANZAS","EJECUTIVO DE COBRANZAS","ADM.GRAL. FONDO SOLIDARIO CRED",653407
"ACADEMICOS","4","INGENIERO CIVIL EN ELECTRICIDAD","ACADEMICO","DPTO INGENIERIA ELECTRICA",1606647
"TECNICO","14","COMPRADOR","COMPRADOR","UNIDAD DE ADQUISICIONES",668676
"PROFESOR HORAS CLASES","S/G","MEDICO CIRUJANO","HORAS CLASE","FACULTAD DE CIENCIAS MEDICAS",125329
"ADMINISTRATIVO","16","CONTADOR GENERAL","ADMINISTRATIVO CONTABLE","VR INVEST. DESARR E INNOVACION",637683
"PROFESIONALES","13","PROFESOR DE EDUCACION MEDIA EN EDUCACION FÍSICA","ENTRENADOR DEPORTIVO","DEPARTAMENTO DE DEPORTES",300115
"PROFESOR HORAS CLASES","S/G","PROFESOR DE EDUCACION MEDIA EN EDUCACION FÍSICA","ENTRENADOR DEPORTIVO","DEPARTAMENTO DE DEPORTES",308865
"PROFESOR HORAS CLASES","S/G","MAGISTER EN ESTADISTICA","HORAS CLASE","DPTO MAT. Y CS. DE LA COMP.",433811
"PROFESOR HORAS CLASES","S/G","BIOQUIMICO","HORAS CLASE","DEPARTAMENTO DE BIOLOGIA",258215
"PROFESOR HORAS CLASES","S/G","MATEMATICA","HORAS CLASE","DPTO MAT. Y CS. DE LA COMP.",528730
"PROFESOR HORAS CLASES","S/G","MAGISTER EN ESTADISTICA","HORAS CLASE","DPTO MAT. Y CS. DE LA COMP.",427130
"ADMINISTRATIVO","16","SECRETARIA DE DIRECCION","SECRETARIA DE DIRECCION","DPTO INGENIERIA OBRAS CIVILES",830283
"PROFESOR HORAS CLASES","S/G","PROFESOR DE ESTADO EN INGLES","HORAS CLASE","DPTO LINGUISTICA Y LITERATURA",629335
"PROFESOR HORAS CLASES","S/G","PROFESOR DE ESTADO EN INGLES","HORAS CLASE","DPTO LINGUISTICA Y LITERATURA",207551
"PROFESOR HORAS CLASES","S/G","TECNICO SUPERIOR EN LA ESPECIALIDAD DE ELECTRONICA","HORAS CLASE","DPTO. TECNOLOGIAS INDUSTRIALES",344683
"PROFESOR HORAS CLASES","S/G","TECNICO SUPERIOR EN LA ESPECIALIDAD DE ELECTRONICA","HORAS CLASE","DPTO. TECNOLOGIAS INDUSTRIALES",121574
"PROFESOR HORAS CLASES","S/G","TECNICO SUPERIOR EN LA ESPECIALIDAD DE ELECTRONICA","HORAS CLASE","DPTO. TECNOLOGIAS INDUSTRIALES",114893
"PROFESOR HORAS CLASES","S/G","GEOLOGO","HORAS CLASE","DPTO INGENIERIA GEOGRAFICA",993829
"PROFESOR HORAS CLASES","S/G","MEDICO CIRUJANO","HORAS CLASE","ESCUELA DE MEDICINA",448839
"TECNICO","18","MUSICO","MUSICO","DEPARTAMENTO DE EXTENSION",475930
"PROFESOR HORAS CLASES","S/G","MAGISTER EN ADMINISTRACION DE EMPRESAS","HORAS CLASE","DPTO CIENCIA Y TEC.DE LOS ALIM",243977
"PROFESIONALES","8","PSICOLOGO","ANALISTA ACREDITACION CARRERA","DIRECCIÓN CALIDAD Y SISTEMAS",1701190
