"Estamento","Grado","Titulo.Oficio","Funcion.Cargo","Unidad","BrutoHaber"
"ACADEMICOS","6","MATRON (A)","ACADEMICO","VICERRECTORIA ACADÉMICA",1335221
"ACADEMICOS","6","DOCTOR EN CIENCIAS APLICADAS EN LA OPCION DE NANOCIENCIAS Y NANOTECNOLOGIAS","ACADEMICO","DEPARTAMENTO DE FISICA",2622706
"PROFESOR HORAS CLASES","S/G","PROFESOR DE ESTADO EN MATEMATICA Y COMPUTACION","HORAS CLASE","DPTO MAT. Y CS. DE LA COMP.",1031796
"PROFESOR HORAS CLASES","S/G","ARQUITECTO","HORAS CLASE","DPTO INGENIERIA GEOGRAFICA",362623
"ACADEMICOS","6","DOCTOR EN FÍSICA","ACADEMICO","DEPARTAMENTO DE FISICA",2640785
"ACADEMICOS","6","INGENIERO CIVIL MATEMATICO","ACADEMICO","VICERRECTORIA ACADÉMICA",2532309
"ADMINISTRATIVO","12","SECRETARIA ADMINISTRATIVA","SECRETARIA ADMINISTRATIVA","DPTO  INGENIERIA INDUSTRIAL",941831
"ACADEMICOS","4","MEDICO CIRUJANO","ACADEMICO","ESCUELA DE MEDICINA",1563654
"PROFESOR HORAS CLASES","S/G","MAGISTER EN CIENCIAS DE LA INGENIERIA MENCION INDUSTRIAL","HORAS CLASE","DPTO. GESTION Y POLITICAS PUB.",243977
"ACADEMICOS","6","DOCTOR EN FARMACOLOGIA","ACADEMICO","DPTO. DE INVEST. CIENTIFICA",2568466
"PROFESOR HORAS CLASES","S/G","MAGISTER EN CIENCIAS DE LA INGENIERIA MENCION INDUSTRIAL","HORAS CLASE","DPTO. GESTION Y POLITICAS PUB.",243977
"PROFESOR HORAS CLASES","S/G","MAGISTER EN CIENCIAS DE LA INGENIERIA MENCION INDUSTRIAL","HORAS CLASE","DPTO. GESTION Y POLITICAS PUB.",243977
"PROFESOR HORAS CLASES","S/G","PSICOLOGO","HORAS CLASE","ESCUELA DE ENFERMERIA",334435
"PROFESOR HORAS CLASES","S/G","PSICOLOGO","HORAS CLASE","UNIDAD PROMOCIÓN DE LA SALUD",81938
"PROFESOR HORAS CLASES","S/G","INGENIERO CIVIL","HORAS CLASE","DPTO  INGENIERIA INDUSTRIAL",130225
"ACADEMICOS","6","PSICOLOGO","DIRECTOR ESCUELA DE PSICOLOGIA","ESCUELA DE PSICOLOGIA",4205164
"PROFESOR HORAS CLASES","S/G","PROFESOR DE INGLES","JEFE DE SECCION","DPTO LINGUISTICA Y LITERATURA",207551
"PROFESIONALES","9","PROFESOR DE INGLES","JEFE DE SECCION","DPTO LINGUISTICA Y LITERATURA",1797124
"ADMINISTRATIVO","13","SECRETARIA DE DECANATO","SECRETARIA DE DECANATO","DPTO CONTABILIDAD Y AUDITOR",973595
"PROFESIONALES","12","RELACIONADOR PUBLICO","RELACIONADOR PUBLICO","DEPARTAMENTO DE COMUNICACIONES",1466038
"PROFESOR HORAS CLASES","S/G","PROFESOR DE INGLES","JEFE DE SECCION","DPTO LINGUISTICA Y LITERATURA",415103
"PROFESOR HORAS CLASES","S/G","MASTER EN DIRECCION DE ADMINISTRACION Y FINANZAS","HORAS CLASE","DPTO INGENIERIA MECANICA",391536
"PROFESOR HORAS CLASES","S/G","MASTER EN DIRECCION DE ADMINISTRACION Y FINANZAS","HORAS CLASE","DPTO DE ADMINISTRACION",659243
"PROFESIONALES","13","BIBLIOTECOLOGO CON MENCION EN AUTOMATIZACION DE UNIDADES DE INFORMACION","ENCARGADO DE ARCHIVO CENTRAL","SECRETARIA GENERAL",1377796
"PROFESOR HORAS CLASES","S/G","INGENIERO CIVIL MECANICO","HORAS CLASE","DPTO. TECNOLOGIAS INDUSTRIALES",445407
