"Estamento","Grado","Titulo.Oficio","Funcion.Cargo","Unidad","BrutoHaber"
"AUXILIARES","23","AUXILIAR","AUXILIAR","UNIDAD DE GESTION DEL CAMPUS",506774
"PROFESOR HORAS CLASES","S/G","HORAS CLASE","HORAS CLASE","DPTO INGENIERIA ELECTRICA",574771
"PROFESOR HORAS CLASES","S/G","PROFESOR DE MATEMATICAS","HORAS CLASE","DPTO MAT. Y CS. DE LA COMP.",718566
"PROFESOR HORAS CLASES","S/G","CONTADOR PUBLICO Y AUDITOR","HORAS CLASE","DPTO CONTABILIDAD Y AUDITOR",243977
"ACADEMICOS","8","INGENIERO CIVIL EN MECANICA","ACADEMICO","DPTO. DE INVEST. CIENTIFICA",522642
"TECNICO","17","EJECUTIVA SECCION COBRANZAS","EJECUTIVA SECCION COBRANZAS","ADM.GRAL. FONDO SOLIDARIO CRED",705759
"ADMINISTRATIVO","17","ADMINISTRATIVO DE PROCESO","ADMINISTRATIVO DE PROCESO","VR INVEST. DESARR E INNOVACION",593503
"PROFESIONALES","9","PROFESOR DE EDUCACION MEDIA EN INGLES","ANALISTA DE PROYECTOS","FACULTAD DE INGENIERÍA",1695343
"ADMINISTRATIVO","16","SECRETARIO(A) B","SECRETARIO(A) B","ESCUELA DE PSICOLOGIA",790604
"ACADEMICOS","6","DOCTOR EN CIENCIAS DE LA INGENIERIA CON MENCION EN INGENIERIA DE PROCESOS","JEFE CARRERA LICENC. CS COMP","DPTO MAT. Y CS. DE LA COMP.",2997910
"PROFESIONALES","8","BIOLOGO","PROFESIONAL","DPTO TRANSFERENCIA TECNOLOGICA",900235
"PROFESOR HORAS CLASES","S/G","PROFESOR DE ESTADO EN HISTORIA Y CIENCIAS SOCIALES","PROFESIONAL","DEPTO DE HISTORIA",196432
"PROFESIONALES","8","PROFESOR DE ESTADO EN HISTORIA Y CIENCIAS SOCIALES","PROFESIONAL","CITECAMP",1891102
"PROFESOR HORAS CLASES","S/G","INGENIERO AGRONOMO","HORAS CLASE","DEPARTAMENTO GESTION AGRARIA",6177
"PROFESOR HORAS CLASES","S/G","INGENIERO AGRONOMO","HORAS CLASE","DEPARTAMENTO GESTION AGRARIA",377309
"ACADEMICOS","4","DOCTOR EN CIENCIAS DE LA TIERRA Y MEDIO AMBIENTE. GEOESTADÍSTICA","ACADEMICO","DPTO INGENIERIA EN MINAS",3128764
"TECNICO","13","TECNICO UNIVERSITARIO EN ANALISIS QUIMICO Y FISICO","ENCARGADO TECNICO LABORATORIO","DPTO. QUIMICA DE LOS MATERIALE",1000255
"PROFESOR HORAS CLASES","S/G","INGENIERO DE EJECUCION EN MECANICA","HORAS CLASE","DPTO. TECNOLOGIAS INDUSTRIALES",100068
"PROFESOR HORAS CLASES","S/G","HORAS CLASE","HORAS CLASE","DPTO. TECNOLOGIAS INDUSTRIALES",488496
"PROFESOR HORAS CLASES","S/G","INGENIERO CIVIL","HORAS CLASE","DPTO INGENIERIA OBRAS CIVILES",99337
"PROFESOR HORAS CLASES","S/G","INGENIERO DE EJECUCION EN QUIMICA","HORAS CLASE","DPTO INGENIERIA EN MINAS",308485
"PROFESOR HORAS CLASES","S/G","INGENIERO DE EJECUCION EN QUIMICA","HORAS CLASE","DPTO INGENIERIA EN MINAS",1342896
"PROFESOR HORAS CLASES","S/G","INGENIERO DE EJECUCION EN MECANICA","HORAS CLASE","DPTO INGENIERIA MECANICA",256280
"ACADEMICOS","6","INGENIERO CIVIL EN MECANICA","ACADEMICO","VICERRECTORIA ACADÉMICA",2586546
"ACADEMICOS","6","MEDICO CIRUJANO","ACADEMICO","ESCUELA DE MEDICINA",2568466
"PROFESOR HORAS CLASES","S/G","INGENIERO DE EJECUCION EN MECANICA","HORAS CLASE","DPTO. TECNOLOGIAS INDUSTRIALES",206819
"ADMINISTRATIVO","15","ASISTENTE DE MANTENCION","ASISTENTE DE MANTENCION","VR. VINCULACION CON EL MEDIO",971458
"ADMINISTRATIVO","17","SECRETARIO B","SECRETARIO B","DPTO DE ECONOMIA",740914
"TECNICO","12","SECRETARIA DE APOYO DOCENTE","SECRETARIA DE APOYO DOCENTE","DEPTO DE HISTORIA",927705
"TECNICO","13","TECNICO EN ADMINISTRACION DE EMPRESAS","TECNICO CONTABLE","DEPTO. DE FINANZAS Y TESORERIA",835422
"ADMINISTRATIVO","17","SECRETARIO B","SECRETARIO B","CENTRO DE INTEGR ING SOCIEDAD",786919
"PROFESOR HORAS CLASES","S/G","ACTOR / ACTRIZ","HORAS CLASE","DPTO LINGUISTICA Y LITERATURA",237296
"PROFESOR HORAS CLASES","S/G","ACTOR / ACTRIZ","HORAS CLASE","DPTO LINGUISTICA Y LITERATURA",481271
"TECNICO","19","ASISTENTE DE MANTENCION","ASISTENTE DE MANTENCION","UNIDAD BIENESTAR DEL PERSONAL",769367
"PROFESOR HORAS CLASES","S/G","PSICOLOGO","HORAS CLASE","DPTO DE ADMINISTRACION",200138
"PROFESOR HORAS CLASES","S/G","PSICOLOGO","HORAS CLASE","DPTO DE ADMINISTRACION",306889
"ACADEMICOS","4","DOUTOR EM ENGENHARIA ELETRICA","ACADEMICO","DPTO INGENIERIA ELECTRICA",3170987
"PROFESOR HORAS CLASES","S/G","PSICOLOGO","HORAS CLASE","DPTO. GESTION Y POLITICAS PUB.",300208
"PROFESOR HORAS CLASES","S/G","MAGISTER EN INGENIERIA INFORMATICA","ANALISTA INFORMATICO","DPTO INGENIERIA INFORMATICA",512557
"TECNICO","16","ADMINISTRATIVO DE COBRANZAS","ADMINISTRATIVO DE COBRANZAS","DEPTO. DE FINANZAS Y TESORERIA",797410
"PROFESIONALES","10","MAGISTER EN INGENIERIA INFORMATICA","ANALISTA INFORMATICO","DPTO INGENIERIA INFORMATICA",1639682
"PROFESOR HORAS CLASES","S/G","INGENIERO DE EJECUCION EN COMPUTACION E INFORMATICA","HORAS CLASE","DPTO INGENIERIA INFORMATICA",115813
"PROFESOR HORAS CLASES","S/G","HORAS CLASE","HORAS CLASE","DPTO. TECNOLOGIAS GENERALES",117872
"PROFESIONALES","8","PERIODISTA","PERIODISTA","DEPARTAMENTO DE ESTUDIOS",1963104
"PROFESIONALES","10","PSICOLOGA","PROFESIONAL","DEPTO. DESARROLLO DE PERSONAS",1475252
"PROFESIONALES","6","PROFESIONAL","PROFESIONAL","VR. VINCULACION CON EL MEDIO",2147234
"PROFESOR HORAS CLASES","S/G","INGENIERO CIVIL EN MINAS","HORAS CLASE","DPTO INGENIERIA EN MINAS",312448
"ACADEMICOS","4","DOCTOR EN CIENCIAS DE LA INGENIERIA CON MENCION EN INGENIERIA DE PROCESOS","ACADEMICO","DPTO INGENIERIA ELECTRICA",3569459
"AUXILIARES","23","AUXILIAR","AUXILIAR","UNIDAD DE GESTION DEL CAMPUS",506774
"PROFESIONALES","13","INGENIERO DE EJECUCION EN CLIMATIZACION","PROFESIONAL","DPTO DE GESTIÓN DE LA INFRAEST",1188565
"ADMINISTRATIVO","17","SECRETARIA DE APOYO DOCENTE","SECRETARIA DE APOYO DOCENTE","FACULTAD DE QUIMICA Y BIOLOGIA",643691
"PROFESOR HORAS CLASES","S/G","DOCTOR EN CIENCIAS DE LA INFORMACION","HORAS CLASE","DEPARTAMENTO GESTION AGRARIA",1036542
"ACADEMICOS","6","DOCTOR EN CIENCIAS DE LA MOTRICIDAD HUMANA","ACADEMICO","CARRERA LICEN CS. ACTIV. FISIC",1517534
"PROFESOR HORAS CLASES","S/G","ADMINISTRADOR PUBLICO","HORAS CLASE","DEPTO DE HISTORIA",102146
"PROFESOR HORAS CLASES","S/G","PROFESORA DE EDUCACION MEDIA EN ARTES PLASTICAS","HORAS CLASE","DPTO LINGUISTICA Y LITERATURA",253469
"AUXILIARES","23","AUXILIAR","AUXILIAR","UNIDAD DE GESTION DEL CAMPUS",506774
"PROFESOR HORAS CLASES","S/G","INGENIERO DE EJECUCION EN COMPUTACION E INFORMATICA","HORAS CLASE","DPTO MAT. Y CS. DE LA COMP.",253768
"PROFESOR HORAS CLASES","S/G","PSICOLOGO","HORAS CLASE","UNIDAD PROMOCIÓN DE LA SALUD",247858
"PROFESOR HORAS CLASES","S/G","MAGISTER EN ESTADISTICA","HORAS CLASE","DPTO MAT. Y CS. DE LA COMP.",362623
"PROFESOR HORAS CLASES","S/G","INGENIERO CIVIL EN OBRAS CIVILES","HORAS CLASE","DPTO INGENIERIA OBRAS CIVILES",574771
"PROFESOR HORAS CLASES","S/G","INGENIERO DE EJECUCION EN MECANICA","HORAS CLASE","DPTO  INGENIERIA INDUSTRIAL",383980
"PROFESOR HORAS CLASES","S/G","MAGISTER EN ESTADISTICA","HORAS CLASE","DPTO MAT. Y CS. DE LA COMP.",375717
"PROFESOR HORAS CLASES","S/G","DOCTOR EN FILOSOFIA CON MENCION EN CIENCIAS FISICAS","HORAS CLASE","DPTO. TECNOLOGIAS INDUSTRIALES",547714
"ACADEMICOS","4","MASTER EN HISTORIA ARTE ARQUITECTURA Y CIUDAD","DIR ESC DE ARQUITECTURA","ESCUELA DE ARQUITECTURA",4330158
"ACADEMICOS","2","MEDICO CIRUJANO","CONSEJERO FACULTAD","ESCUELA DE MEDICINA",4107559
"ADMINISTRATIVO","16","SECRETARIA EJECUTIVA TRADUCTORA BILINGUE","SECRETARIA DE APOYO DOCENTE","DPTO INGENIERIA EN MINAS",809319
"PROFESIONALES","13","PERIODISTA","PERIODISTA","DEPARTAMENTO DE COMUNICACIONES",1188565
"ADMINISTRATIVO","17","SECRETARIADO COMERCIAL","SECRETARIA ADMINISTRATIVA","DPTO. TECNOLOGIAS GENERALES",844426
"PROFESIONALES","14","INGENIERO DE EJECUCION EN ADMINISTRACION DE EMPRESAS","ANALISTA EN GESTION ADM.","DPTO MAT. Y CS. DE LA COMP.",1461592
"PROFESOR HORAS CLASES","S/G","INGENIERO CIVIL","HORAS CLASE","DPTO INGENIERIA OBRAS CIVILES",191994
"PROFESOR HORAS CLASES","S/G","PROFESOR DE EDUCACION GENERAL BASICA","HORAS CLASE","DEPARTAMENTO DE FISICA",509746
"PROFESOR HORAS CLASES","S/G","ENFERMERA","HORAS CLASE","ESCUELA DE ENFERMERIA",637453
"ACADEMICOS","8","CONTADOR PUBLICO Y AUDITOR","ACADEMICO","DPTO. DE INVEST. CIENTIFICA",2110092
"ADMINISTRATIVO","16","SECRETARIA DE DEPARTAMENTO","SECRETARIA DE DEPARTAMENTO","CECTA",875776
"ADMINISTRATIVO","20","ASISTENTE DE BIBLIOTECA","ASISTENTE DE BIBLIOTECA","FACULTAD DE CIENCIAS MEDICAS",709507
"PROFESIONALES","12","TECNOLOGO EN ADMINISTRACION DE PERSONAL","ANALISTA II","UNIDAD DE COORDINACIÓN INSTIT.",1525465
"TECNICO","18","GASFITER","GASFITER","UNIDAD DE GESTION DEL CAMPUS",1154093
"PROFESIONALES","10","SOCIOLOGO","ANALISTA DE CALIDAD","DIRECCIÓN CALIDAD Y SISTEMAS",1611162
"PROFESIONALES","9","MAGISTER EN EDUCACION CON MENCION EN CURRICULUM Y EVALUACION","JEFE DE LABORATORIO","DPTO. TECNOLOGIAS INDUSTRIALES",1976818
"PROFESIONALES","9","CONTADOR AUDITOR","JEFE DE SECCION","UNIDAD BIENESTAR DEL PERSONAL",1761969
"PROFESOR HORAS CLASES","S/G","MAGISTER EN EDUCACION CON MENCION EN CURRICULUM Y EVALUACION","JEFE DE LABORATORIO","DPTO. TECNOLOGIAS INDUSTRIALES",925451
"PROFESOR HORAS CLASES","S/G","HORAS CLASE","HORAS CLASE","DPTO  INGENIERIA INDUSTRIAL",448487
"PROFESOR HORAS CLASES","S/G","SOCIOLOGO","HORAS CLASE","DPTO INGENIERIA INFORMATICA",261026
"PROFESOR HORAS CLASES","S/G","CONTADOR PUBLICO Y AUDITOR","HORAS CLASE","DPTO INGENIERIA METALURGICA",154518
"PROFESOR HORAS CLASES","S/G","HORAS CLASE","HORAS CLASE","DPTO INGENIERIA ELECTRICA",455168
"ACADEMICOS","6","MAGISTER EN ARQUITECTURA","DIR DEPTO  TECNO GENERALES","DPTO. TECNOLOGIAS GENERALES",4294332
"PROFESOR HORAS CLASES","S/G","SOCIOLOGO","HORAS CLASE","DPTO INGENIERIA INFORMATICA",130513
"PROFESOR HORAS CLASES","S/G","SOCIOLOGO","HORAS CLASE","DPTO INGENIERIA INFORMATICA",267707
"PROFESOR HORAS CLASES","S/G","MASTER EN ESTADISTICA MATEMATICA","HORAS CLASE","DPTO DE ADMINISTRACION",623648
"ACADEMICOS","2","MEDICO CIRUJANO","ACADEMICO","ESCUELA DE MEDICINA",3076282
"PROFESOR HORAS CLASES","S/G","QUIMICO","HORAS CLASE","DPTO. QUIMICA DE LOS MATERIALE",451377
"PROFESOR HORAS CLASES","S/G","HORAS CLASE","HORAS CLASE","ESCUELA DE OBST Y PUERICULTURA",662189
"PROFESOR HORAS CLASES","S/G","MAGISTER EN INNOVACION","HORAS CLASE","DPTO. TECNOLOGIAS GENERALES",615342
"PROFESOR HORAS CLASES","S/G","MAGISTER ARTIUM EN LA MENCION DE HISTORIA","HORAS CLASE","DEPTO DE HISTORIA",294247
"PROFESOR HORAS CLASES","S/G","MAGISTER EN ASENTAMIENTOS HUMANOS Y MEDIO AMBIENTE","HORAS CLASE","PROGRAMA BACHILLERATO",289501
"PROFESOR HORAS CLASES","S/G","MAGISTER EN ASENTAMIENTOS HUMANOS Y MEDIO AMBIENTE","HORAS CLASE","PROGRAMA BACHILLERATO",275025
"PROFESOR HORAS CLASES","S/G","PROFESOR DE ESTADO EN HISTORIA Y GEOGRAFIA","HORAS CLASE","DPTO LINGUISTICA Y LITERATURA",189019
"PROFESOR HORAS CLASES","S/G","DOCTOR EN ESTUDIOS AMERICANOS ESPECIALIDAD PENSAMIENTO Y CULTURA","HORAS CLASE","ESCUELA DE ARQUITECTURA",42831
"PROFESOR HORAS CLASES","S/G","INGENIERO MATEMATICO","HORAS CLASE","DPTO MAT. Y CS. DE LA COMP.",284651
"PROFESOR HORAS CLASES","S/G","MAGISTER ARTIUM EN LA MENCION DE HISTORIA","HORAS CLASE","DEPTO DE HISTORIA",300928
"PROFESOR HORAS CLASES","S/G","DOCTOR EN ESTUDIOS AMERICANOS ESPECIALIDAD PENSAMIENTO Y CULTURA","HORAS CLASE","ESCUELA DE ARQUITECTURA",209568
"PROFESOR HORAS CLASES","S/G","PROFESOR DE ESTADO EN HISTORIA Y GEOGRAFIA","HORAS CLASE","DPTO LINGUISTICA Y LITERATURA",248723
"PROFESOR HORAS CLASES","S/G","MAGISTER EN ASENTAMIENTOS HUMANOS Y MEDIO AMBIENTE","HORAS CLASE","PROGRAMA BACHILLERATO",440930
"ADMINISTRATIVO","17","ADMINISTRATIVO DE REGISTRO CUR","ADMINISTRATIVO DE REGISTRO CUR","FACULTAD DE CIENCIAS MEDICAS",728762
"PROFESOR HORAS CLASES","S/G","INGENIERO CIVIL EN MINAS","HORAS CLASE","DPTO INGENIERIA EN MINAS",210525
"PROFESOR HORAS CLASES","S/G","GEOGRAFO","HORAS CLASE","DPTO INGENIERIA GEOGRAFICA",362623
"PROFESIONALES","10","ANALISTA DE GESTION ESTRATEGIC","ANALISTA DE GESTION ESTRATEGIC","DEPTO. DE GESTION ESTRATEGICA",1627081
"PROFESOR HORAS CLASES","S/G","CIENTISTA POLITICA","HORAS CLASE","DEPTO DE HISTORIA",2968
"PROFESOR HORAS CLASES","S/G","COMUNICADOR AUDIOVISUAL MENCION VIDEO","HORAS CLASE","DEPTO. DE PUBLICIDAD E IMAGEN",191994
"PROFESOR HORAS CLASES","S/G","PROFESOR DE ESTADO EN FISICA Y MATEMATICA","HORAS CLASE","DEPARTAMENTO DE FISICA",284651
"PROFESOR HORAS CLASES","S/G","PROFESOR DE ESTADO EN FISICA Y MATEMATICA","HORAS CLASE","DEPARTAMENTO DE FISICA",92656
"PROFESOR HORAS CLASES","S/G","PSICOLOGO","HORAS CLASE","ESCUELA DE PSICOLOGIA",89043
"PROFESOR HORAS CLASES","S/G","MAGISTER EN CIENCIAS. MENCION ANATOMIA HUMANA","ACADEMICO","ESCUELA DE MEDICINA",80392
"PROFESOR HORAS CLASES","S/G","PUBLICISTA CON MENCION EN GESTION CREATIVA","HORAS CLASE","DEPTO. DE PUBLICIDAD E IMAGEN",161283
"PROFESOR HORAS CLASES","S/G","MAGISTER EN CIENCIAS. MENCION ANATOMIA HUMANA","ACADEMICO","ESCUELA DE MEDICINA",160786
"PROFESOR HORAS CLASES","S/G","ARQUITECTO","HORAS CLASE","ESCUELA DE ARQUITECTURA",272453
"ACADEMICOS","6","MAGISTER EN CIENCIAS. MENCION ANATOMIA HUMANA","ACADEMICO","VICERRECTORIA ACADÉMICA",1921906
"PROFESOR HORAS CLASES","S/G","PROFESOR DE ESTADO EN MATEMATICA Y COMPUTACION","HORAS CLASE","DPTO MAT. Y CS. DE LA COMP.",761279
"ADMINISTRATIVO","15","SECRETARIA DE DEPARTAMENTO","SECRETARIA DE DEPARTAMENTO","DEPARTAMENTO DE COMUNICACIONES",897375
"TECNICO","14","TECNICO EN ADMINISTRACION FINANCIERA","TECNICO CONTABLE","UNIDAD REGIST. ACAD Y CURRICUL",735845
"PROFESIONALES","8","ANALISTA DE PROYECTOS I","ANALISTA DE PROYECTOS I","UNIDAD DESARR. PROYECTOS TECN.",1801945
"ADMINISTRATIVO","10","SECRETARIA DE RECTOR","SECRETARIA DE RECTOR","RECTORIA",1026283
"PROFESOR HORAS CLASES","S/G","PUBLICISTA","HORAS CLASE","DPTO INGENIERIA GEOGRAFICA",265772
"PROFESOR HORAS CLASES","S/G","PUBLICISTA","HORAS CLASE","DEPTO. DE PUBLICIDAD E IMAGEN",214232
"PROFESOR HORAS CLASES","S/G","PSICOLOGO","HORAS CLASE","ESCUELA DE PSICOLOGIA",481271
"ADMINISTRATIVO","20","ADMINISTRATIVO","ADMINISTRATIVO","ESCUELA DE PSICOLOGIA",545788
"PROFESIONALES","10","TECNOLOGO EN ADMINISTRACION DE PERSONAL","JEFE ADMINISTRACION Y FINANZAS","DIRECCIÓN DE POSTGRADO",1706675
"ADMINISTRATIVO","20","SECRETARIA(O) C ADMINISTRATIVO","SECRETARIA(O) C ADMINISTRATIVO","FACULTAD DE HUMANIDADES",692192
"PROFESOR HORAS CLASES","S/G","HORAS CLASE","HORAS CLASE","DPTO. QUIMICA DE LOS MATERIALE",509746
"TECNICO","17","ASISTENTE DE MANTENCION","ASISTENTE DE MANTENCION","DPTO INGENIERIA METALURGICA",951629
"ACADEMICOS","4","TERAPEUTA OCUPACIONAL","DIRECTORA DPTO FORMAC INTEGRAL","VICERRECTORIA ACADÉMICA",3493212
"PROFESOR HORAS CLASES","S/G","MEDICO CIRUJANO","HORAS CLASE","ESCUELA DE MEDICINA",470483
"PROFESOR HORAS CLASES","S/G","MEDICO CIRUJANO","HORAS CLASE","ESCUELA DE MEDICINA",454800
"PROFESOR HORAS CLASES","S/G","MEDICO CIRUJANO","HORAS CLASE","ESCUELA DE MEDICINA",470483
"PROFESOR HORAS CLASES","S/G","MEDICO CIRUJANO","HORAS CLASE","ESCUELA DE MEDICINA",470483
"PROFESIONALES","12","PERIODISTA","PERIODISTA","RADIOEMISORAS",1543572
"PROFESOR HORAS CLASES","S/G","INGENIERO DE EJECUCION EN ELECTRICIDAD","HORAS CLASE","DPTO. TECNOLOGIAS INDUSTRIALES",3432
"PROFESOR HORAS CLASES","S/G","INGENIERO DE EJECUCION EN ELECTRICIDAD","HORAS CLASE","DPTO. TECNOLOGIAS INDUSTRIALES",374232
"PROFESIONALES","8","ASISTENTE SOCIAL","ASIST SOCIAL BIEN ESTUDIANTIL","FACULTAD DE INGENIERÍA",2085956
"PROFESOR HORAS CLASES","S/G","PROFESOR DE ESTADO EN HISTORIA Y CIENCIAS SOCIALES","HORAS CLASE","DEPTO DE HISTORIA",356327
"PROFESIONALES","11","MAGISTER EN CIENCIAS QUIMICAS","ENCARGADO DE LABORATORIO","FACULTAD DE QUIMICA Y BIOLOGIA",1636945
"PROFESOR HORAS CLASES","S/G","MEDICO VETERINARIO","HORAS CLASE","ESCUELA DE MEDICINA",686925
"PROFESOR HORAS CLASES","S/G","INGENIERO DE EJECUCION EN QUIMICA","HORAS CLASE","DPTO. TECNOLOGIAS INDUSTRIALES",243882
"PROFESOR HORAS CLASES","S/G","MAGISTER EN FINANZAS","HORAS CLASE","DPTO CONTABILIDAD Y AUDITOR",243977
"ADMINISTRATIVO","10","REGISTRADOR CURRICULAR","REGISTRADOR CURRICULAR","FACULTAD DE CIENCIAS MEDICAS",1171493
"PROFESOR HORAS CLASES","S/G","DOCTOR OF ENGINEERING SCIENCE","HORAS CLASE","DPTO. TECNOLOGIAS INDUSTRIALES",512557
"PROFESOR HORAS CLASES","S/G","DOCTOR EN QUIMICA","HORAS CLASE","DPTO. CIENCIAS DEL AMBIENTE",383980
"PROFESOR HORAS CLASES","S/G","PROFESOR DE EDUCACION MEDIA EN CASTELLANO","HORAS CLASE","DPTO LINGUISTICA Y LITERATURA",185313
"PROFESOR HORAS CLASES","S/G","MATRON (A)","HORAS CLASE","ESCUELA DE OBST Y PUERICULTURA",572519
"PROFESOR HORAS CLASES","S/G","DOCTOR OF ENGINEERING SCIENCE","HORAS CLASE","DPTO. TECNOLOGIAS INDUSTRIALES",262961
"PROFESOR HORAS CLASES","S/G","PROFESOR DE EDUCACION MEDIA EN CASTELLANO","HORAS CLASE","DPTO LINGUISTICA Y LITERATURA",191994
"PROFESOR HORAS CLASES","S/G","MAGISTER EN CIENCIA EN LA ESPECIALIDAD DE MATEMATICA","HORAS CLASE","DPTO MAT. Y CS. DE LA COMP.",1050780
"PROFESOR HORAS CLASES","S/G","HORAS CLASE","HORAS CLASE","DPTO INGENIERIA INFORMATICA",90165
"ACADEMICOS","6","DOCTOR EN CIENCIAS CON MENCION EN FISICA","ACADEMICO","DEPARTAMENTO DE FISICA",2586546
"ACADEMICOS","8","MAGISTER EN CIENCIAS DE LA INGENIERIA MENCION CIENCIA E INGENIERIA DE LOS MATERIALES","ACADEMICO","DPTO. DE INVEST. CIENTIFICA",1054312
"PROFESOR HORAS CLASES","S/G","INGENIERO CIVIL EN INFORMATICA","HORAS CLASE","DPTO CONTABILIDAD Y AUDITOR",167467
"TECNICO","19","TRABAJADOR SOCIAL CON MENCION EN INTERVENCION SOCIAL","ASISTENTE DE MANTENCION","DEPARTAMENTO DE EXTENSION",278386
"PROFESIONALES","12","PROFESOR DE ESTADO DE HISTORIA Y GEOGRAFIA","ANALISTA","VICERRECTORIA ACADÉMICA",1089664
"ACADEMICOS","6","DOCTOR EN QUIMICA","JEFE CARR TEC ANALIS QCO Y FIS","DPTO. CIENCIAS DEL AMBIENTE",2961751
"PROFESOR HORAS CLASES","S/G","INGENIERO CIVIL ELECTRICISTA","HORAS CLASE","DPTO INGENIERIA ELECTRICA",616967
"PROFESOR HORAS CLASES","S/G","INGENIERO CIVIL ELECTRICISTA","HORAS CLASE","DPTO INGENIERIA ELECTRICA",623648
"PROFESOR HORAS CLASES","S/G","INGENIERIO ELECTRICISTA","HORAS CLASE","DPTO INGENIERIA ELECTRICA",243977
"PROFESOR HORAS CLASES","S/G","MAGISTER EN ARTE TERAPIA","HORAS CLASE","ESCUELA DE PSICOLOGIA",99337
"PROFESOR HORAS CLASES","S/G","INGENIERO CIVIL EN MECANICA","HORAS CLASE","DPTO INGENIERIA EN MINAS",167467
"PROFESOR HORAS CLASES","S/G","HORAS CLASE","HORAS CLASE","ESCUELA DE MEDICINA",718566
"PROFESOR HORAS CLASES","S/G","INGENIERO CIVIL EN MECANICA","HORAS CLASE","DPTO INGENIERIA METALURGICA",160786
"PROFESIONALES","14","COMUNICADOR SOCIAL EN MARKETING","PROFESIONAL","CENTRO DE INTEGR ING SOCIEDAD",1347793
"PROFESOR HORAS CLASES","S/G","ENFERMERA","HORAS CLASE","ESCUELA DE ENFERMERIA",559379
"PROFESOR HORAS CLASES","S/G","HORAS CLASE","HORAS CLASE","DPTO INGENIERIA EN MINAS",500255
"PROFESOR HORAS CLASES","S/G","DOCTOR EN MEDICINA","HORAS CLASE","ESCUELA DE MEDICINA",315546
"PROFESOR HORAS CLASES","S/G","INGENIERO FISICO","HORAS CLASE","DEPARTAMENTO DE FISICA",362623
"PROFESOR HORAS CLASES","S/G","PROFESOR DE INGLES","HORAS CLASE","DPTO LINGUISTICA Y LITERATURA",399547
"PROFESOR HORAS CLASES","S/G","MAGISTER EN DERECHO. MENCION EN DERECHO INTERNACIONAL","HORAS CLASE","DPTO DE ADMINISTRACION",560016
"PROFESOR HORAS CLASES","S/G","INGENIERO COMERCIAL","HORAS CLASE","DPTO CONTABILIDAD Y AUDITOR",191994
"PROFESOR HORAS CLASES","S/G","HORAS CLASE","HORAS CLASE","ESCUELA DE ARQUITECTURA",993829
"PROFESOR HORAS CLASES","S/G","INGENIERO EN ELECTRONICA","HORAS CLASE","DPTO INGENIERIA ELECTRICA",125329
"PROFESOR HORAS CLASES","S/G","CONTADOR AUDITOR","HORAS CLASE","DPTO CONTABILIDAD Y AUDITOR",281944
"PROFESOR HORAS CLASES","S/G","PROFESOR DE INGLES","HORAS CLASE","DPTO LINGUISTICA Y LITERATURA",625085
"PROFESOR HORAS CLASES","S/G","MAGISTER EN ADMINISTRACION (MBA) CON MENCION GESTION EN FINANZAS","HORAS CLASE","DPTO  INGENIERIA INDUSTRIAL",376861
"PROFESOR HORAS CLASES","S/G","DOCTOR EN ESTUDIOS AMERICANOS ESPECIALIDAD ESTUDIOS INTERNACIONALES","HORAS CLASE","DEPTO DE HISTORIA",246788
"PROFESOR HORAS CLASES","S/G","HORAS CLASE","HORAS CLASE","DPTO INGENIERIA GEOGRAFICA",161283
"PROFESOR HORAS CLASES","S/G","DOCTOR EN ESTUDIOS AMERICANOS ESPECIALIDAD ESTUDIOS INTERNACIONALES","HORAS CLASE","DEPTO DE HISTORIA",61696
"PROFESOR HORAS CLASES","S/G","MAGISTER EN DERECHO. MENCION EN DERECHO INTERNACIONAL","HORAS CLASE","DPTO LINGUISTICA Y LITERATURA",286690
"PROFESOR HORAS CLASES","S/G","INGENIERIA CIVIL EN QUIMICA","HORAS CLASE","DPTO INGENIERIA QUIMICA",149496
"PROFESOR HORAS CLASES","S/G","INGENIERO CIVIL EN INFORMATICA","HORAS CLASE","DPTO INGENIERIA INFORMATICA",538222
"PROFESOR HORAS CLASES","S/G","INGENIERIA CIVIL EN QUIMICA","HORAS CLASE","DPTO INGENIERIA QUIMICA",156177
"PROFESOR HORAS CLASES","S/G","PROFESOR DE FISICA","HORAS CLASE","DEPARTAMENTO DE FISICA",1292343
"PROFESOR HORAS CLASES","S/G","INGENIERO EN ALIMENTOS","HORAS CLASE","DPTO CIENCIA Y TEC.DE LOS ALIM",225350
"PROFESOR HORAS CLASES","S/G","INGENIERO EN ALIMENTOS","HORAS CLASE","DPTO CIENCIA Y TEC.DE LOS ALIM",109334
"PROFESOR HORAS CLASES","S/G","INGENIERO EN ALIMENTOS","HORAS CLASE","DPTO CIENCIA Y TEC.DE LOS ALIM",109334
"ACADEMICOS","4","DOCTOR EN HISTORIA MENCION EN HISTORIA DE CHILE","ACADEMICO","DEPTO DE HISTORIA",3297654
"PROFESOR HORAS CLASES","S/G","PROFESOR DE INGLES","HORAS CLASE","DPTO LINGUISTICA Y LITERATURA",340619
"PROFESOR HORAS CLASES","S/G","DOCTOR EN ESTUDIOS AMERICANOS ESPECIALIDAD ESTUDIOS INTERNACIONALES","HORAS CLASE","DEPTO DE HISTORIA",191771
"PROFESOR HORAS CLASES","S/G","INGENIERO CIVIL INDUSTRIAL","ASESOR","DPTO INGENIERIA GEOGRAFICA",265772
"TECNICO","13","ENCARGADO TECNICO LABORATORIO","ENCARGADO TECNICO LABORATORIO","DEPTO. DE PUBLICIDAD E IMAGEN",1066906
"TECNICO","19","ASISTENTE DE MANTENCION","ASISTENTE DE MANTENCION","DEPARTAMENTO DE COMUNICACIONES",568991
"TECNICO","19","ASISTENTE DE MANTENCION","ASISTENTE DE MANTENCION","DEPARTAMENTO DE COMUNICACIONES",636160
"AUXILIARES","21","AUXILIAR DE SERVICIOS","AUXILIAR DE SERVICIOS","DPTO  INGENIERIA INDUSTRIAL",867393
"PROFESIONALES","13","EDUCADORA DE PARVULOS","EDUCADOR DE PARVULOS","UNIDAD BIENESTAR DEL PERSONAL",1525640
"PROFESIONALES","6","INGENIERO CIVIL INDUSTRIAL","ASESOR","CENTRO DE INTEGR ING SOCIEDAD",2269913
"PROFESIONALES","11","BIOTECNOLOGO MENCION GESTION TECNOLOGICA","PROFESIONAL","CECTA",1396120
"AUXILIARES","21","AUXILIAR DE SERVICIOS","AUXILIAR DE SERVICIOS","PROGRAMA BACHILLERATO",836900
"ADMINISTRATIVO","16","SECRETARIA DE CENTRO","SECRETARIA DE CENTRO","CENTRO INNOV. Y TRANSFER.TECN",809319
"PROFESIONALES","11","INGENIERO DE EJECUCION EN ALIMENTOS","ENCARGADO DE LABORATORIO","DPTO CIENCIA Y TEC.DE LOS ALIM",1727597
"PROFESIONALES","8","INGENIERO CIVIL DE INDUSTRIAL","ASESOR DE RECTORIA","RECTORIA",1701190
"PROFESIONALES","10","PSICOLOGO","ANALISTA DE LA CALIDAD","DIRECCIÓN CALIDAD Y SISTEMAS",1576007
"TECNICO","9","TECNICO SUPERIOR EN ELECTRONICA CON MENCION EN MICROCOMPUTADORES","TEC. DE SOPORTE Y ESPECIALIDAD","RADIOEMISORAS",1097863
"ADMINISTRATIVO","17","TRABAJADOR SOCIAL","ADMINISTRATIVO DE PROCESO","FACULTAD DE INGENIERÍA",593503
"PROFESIONALES","11","TECNOLOGO EN ADMINISTRACION DE PERSONAL","PROFESIONAL","DEPARTAMENTO DE COMUNICACIONES",1769152
"TECNICO","17","AUXILIAR DE ENFERMERIA","AUXILIAR DE ENFERMERIA","CENTRO DE SALUD",752416
"PROFESOR HORAS CLASES","S/G","INGENIERO CIVIL INDUSTRIAL","ASESOR","DPTO  INGENIERIA INDUSTRIAL",265772
"PROFESOR HORAS CLASES","S/G","INGENIERO DE EJECUCION EN ALIMENTOS","ENCARGADO DE LABORATORIO","DPTO CIENCIA Y TEC.DE LOS ALIM",607475
"PROFESOR HORAS CLASES","S/G","DOTTORE IN PEDAGOGIA CON LODE","HORAS CLASE","DEPARTAMENTO DE EDUCACIÓN",528730
"PROFESOR HORAS CLASES","S/G","TRABAJADOR SOCIAL","HORAS CLASE","ESCUELA DE PSICOLOGIA",92656
"PROFESOR HORAS CLASES","S/G","TRABAJADOR SOCIAL","HORAS CLASE","ESCUELA DE PSICOLOGIA",99337
"PROFESOR HORAS CLASES","S/G","BACHAREL EN LETRAS","HORAS CLASE","DPTO LINGUISTICA Y LITERATURA",238582
"PROFESIONALES","12","TECNOLOGO EN CONSTRUCCIONES","PROYECTISTA SANITARIO","UNIDAD DE CONSTRUCCIÓN",1543572
"PROFESOR HORAS CLASES","S/G","TECNOLOGO EN TELECOMUNICACIONES","HORAS CLASE","DPTO. TECNOLOGIAS INDUSTRIALES",61029
"PROFESOR HORAS CLASES","S/G","TECNOLOGO EN TELECOMUNICACIONES","HORAS CLASE","DPTO. TECNOLOGIAS INDUSTRIALES",681222
"ACADEMICOS","6","DOCTOR EN FARMACOLOGIA","ACADEMICO","DEPARTAMENTO DE BIOLOGIA",2532309
"PROFESOR HORAS CLASES","S/G","HORAS CLASE","HORAS CLASE","DPTO  INGENIERIA INDUSTRIAL",47863
"TECNICO","20","MUSICO","MUSICO","DEPARTAMENTO DE EXTENSION",755156
"PROFESOR HORAS CLASES","S/G","HORAS CLASE","HORAS CLASE","DPTO CIENCIA Y TEC.DE LOS ALIM",160786
"PROFESOR HORAS CLASES","S/G","HORAS CLASE","HORAS CLASE","DPTO INGENIERIA QUIMICA",247858
"PROFESIONALES","8","ABOGADO(A)","ABOGADO","DIR. ASISTENCIA JURIDICA",1855101
"TECNICO","17","AUXILIAR DE ENFERMERIA","AUXILIAR DE ENFERMERIA","CENTRO DE SALUD",705759
"PROFESOR HORAS CLASES","S/G","DOCTOR EN ARQUITECTURA Y PATRIMONIO CULTURAL-AMBIENTAL(INVEST. REFLEX. ACCION)","HORAS CLASE","DEPTO DE HISTORIA",512557
"PROFESOR HORAS CLASES","S/G","MEDICO CIRUJANO","HORAS CLASE","ESCUELA DE MEDICINA",491354
"PROFESOR HORAS CLASES","S/G","DOCTOR EN ARQUITECTURA Y PATRIMONIO CULTURAL-AMBIENTAL(INVEST. REFLEX. ACCION)","HORAS CLASE","DEPTO DE HISTORIA",256280
"PROFESOR HORAS CLASES","S/G","HORAS CLASE","HORAS CLASE","DPTO MAT. Y CS. DE LA COMP.",392134
"PROFESOR HORAS CLASES","S/G","HORAS CLASE","HORAS CLASE","DPTO MAT. Y CS. DE LA COMP.",385453
"ADMINISTRATIVO","17","ADMINISTRATIVO DE PROCESO","ADMINISTRATIVO DE PROCESO","DPTO. DE RECURSOS HUMANOS",660672
"TECNICO","18","TECNICO EN MAQUINAS OFFSETT","TECNICO EN MAQUINAS OFFSETT","DPTO INGENIERIA MECANICA",926082
"ADMINISTRATIVO","12","ADMINISTRATIVO ESPECIALES","ADMINISTRATIVO ESPECIALES","SELLO EDITORIAL",899452
"PROFESOR HORAS CLASES","S/G","PROFESOR DE ESTADO EN MATEMATICA Y COMPUTACION","HORAS CLASE","DPTO MAT. Y CS. DE LA COMP.",1140474
"PROFESOR HORAS CLASES","S/G","CONTADOR AUDITOR","HORAS CLASE","DPTO CONTABILIDAD Y AUDITOR",243977
"PROFESOR HORAS CLASES","S/G","ADMINISTRADOR PUBLICO","HORAS CLASE","DPTO. GESTION Y POLITICAS PUB.",47863
"PROFESIONALES","14","TECNOLOGO EN CONTROL INDUSTRIAL","ANALISTA","UNIDAD DE ADQUISICIONES",1248536
"PROFESOR HORAS CLASES","S/G","INGENIERO CIVIL ELECTRONICO","HORAS CLASE","DPTO INGENIERIA ELECTRICA",322067
