"Estamento","Grado","Titulo.Oficio","Funcion.Cargo","Unidad","BrutoHaber"
"AUXILIARES","23","AUXILIAR","AUXILIAR","UNIDAD DE GESTION DEL CAMPUS",489881
"PROFESOR HORAS CLASES","S/G","PROFESOR DE MATEMATICAS","HORAS CLASE","DPTO MAT. Y CS. DE LA COMP.",1078194
"PROFESOR HORAS CLASES","S/G","HORAS CLASE","HORAS CLASE","DPTO INGENIERIA ELECTRICA",490763
"ADMINISTRATIVO","17","SECRETARIA DE SUBDIRECCION","SECRETARIA DE SUBDIRECCION","ESCUELA DE PSICOLOGIA",743634
"PROFESIONALES","10","PROFESOR DE EDUCACION MEDIA EN INGLES","ANALISTA DE PROYECTOS","FACULTAD DE INGENIERÍA",846092
"TECNICO","17","EJECUTIVA SECCION COBRANZAS","EJECUTIVA SECCION COBRANZAS","ADM.GRAL. FONDO SOLIDARIO CRED",727336
"ADMINISTRATIVO","17","ADMINISTRATIVO DE PROCESO","ADMINISTRATIVO DE PROCESO","DPTO TRANSFERENCIA TECNOLOGICA",593503
"PROFESOR HORAS CLASES","S/G","PROFESOR DE EDUCACION MEDIA EN INGLES","ANALISTA DE PROYECTOS","DPTO INGENIERIA OBRAS CIVILES",251534
"PROFESOR HORAS CLASES","S/G","PROFESOR DE EDUCACION MEDIA EN INGLES","ANALISTA DE PROYECTOS","DPTO LINGUISTICA Y LITERATURA",163878
"ACADEMICOS","6","DOCTOR EN CIENCIAS DE LA INGENIERIA CON MENCION EN INGENIERIA DE PROCESOS","JEFE CARRERA LICENC. CS COMP","DPTO MAT. Y CS. DE LA COMP.",2997910
"PROFESIONALES","8","BIOLOGO","PROFESIONAL","VR INVEST. DESARR E INNOVACION",972189
"PROFESIONALES","8","PROFESOR DE ESTADO EN HISTORIA Y CIENCIAS SOCIALES","PROFESIONAL","CITECAMP",1822515
"PROFESOR HORAS CLASES","S/G","PROFESOR DE ESTADO EN HISTORIA Y CIENCIAS SOCIALES","PROFESIONAL","DEPTO DE HISTORIA",192726
"PROFESOR HORAS CLASES","S/G","PROFESOR DE FILOSOFIA","HORAS CLASE","FACULTAD DE CIENCIAS MEDICAS",315883
"ACADEMICOS","4","DOCTOR EN CIENCIAS DE LA TIERRA Y MEDIO AMBIENTE. GEOESTADÍSTICA","ACADEMICO","DPTO INGENIERIA EN MINAS",3107652
"PROFESOR HORAS CLASES","S/G","INGENIERO AGRONOMO","HORAS CLASE","DEPARTAMENTO GESTION AGRARIA",299308
"TECNICO","14","TECNICO UNIVERSITARIO EN ANALISIS QUIMICO Y FISICO","TECNICO ESPECIALIZADO","DPTO. QUIMICA DE LOS MATERIALE",943269
"PROFESOR HORAS CLASES","S/G","PROFESOR DE ESTADO EN MATEMATICA Y COMPUTACION","HORAS CLASE","DPTO MAT. Y CS. DE LA COMP.",289501
"ACADEMICOS","6","INGENIERO CIVIL EN MECANICA","ACADEMICO","VICERRECTORIA ACADÉMICA",2671870
"ACADEMICOS","6","MEDICO CIRUJANO","ACADEMICO","ESCUELA DE MEDICINA",2653790
"PROFESOR HORAS CLASES","S/G","PROFESOR DE ESTADO EN MATEMATICA Y COMPUTACION","HORAS CLASE","DPTO MAT. Y CS. DE LA COMP.",217125
"PROFESOR HORAS CLASES","S/G","PROFESOR DE ESTADO EN MATEMATICA Y COMPUTACION","HORAS CLASE","DPTO MAT. Y CS. DE LA COMP.",296182
"PROFESOR HORAS CLASES","S/G","PROFESOR DE ESTADO EN MATEMATICA Y COMPUTACION","HORAS CLASE","DPTO MAT. Y CS. DE LA COMP.",72374
"PROFESOR HORAS CLASES","S/G","INGENIERO DE EJECUCION EN QUIMICA","HORAS CLASE","DPTO INGENIERIA EN MINAS",1342896
"PROFESOR HORAS CLASES","S/G","INGENIERO DE EJECUCION EN QUIMICA","HORAS CLASE","DPTO INGENIERIA EN MINAS",308485
"PROFESOR HORAS CLASES","S/G","MAGISTER EN HISTORIA EN LA MENCION DE HISTORIA DE CHILE","HORAS CLASE","DEPTO DE HISTORIA",191994
"PROFESOR HORAS CLASES","S/G","INGENIERO DE EJECUCION EN MECANICA","HORAS CLASE","DPTO INGENIERIA MECANICA",256280
"PROFESOR HORAS CLASES","S/G","TERAPEUTA OCUPACIONAL","HORAS CLASE","FACULTAD DE CIENCIAS MEDICAS",161283
"PROFESOR HORAS CLASES","S/G","INGENIERO DE EJECUCION EN MECANICA","HORAS CLASE","DPTO. TECNOLOGIAS INDUSTRIALES",577204
"PROFESOR HORAS CLASES","S/G","HORAS CLASE","HORAS CLASE","DPTO. TECNOLOGIAS INDUSTRIALES",696073
"TECNICO","12","SECRETARIA DE APOYO DOCENTE","SECRETARIA DE APOYO DOCENTE","DEPTO DE HISTORIA",914127
"ADMINISTRATIVO","17","SECRETARIO B","SECRETARIO B","DPTO DE ECONOMIA",727336
"ADMINISTRATIVO","16","TECNICO AUDIOVISUAL","TECNICO AUDIOVISUAL","VR. VINCULACION CON EL MEDIO",964523
"ADMINISTRATIVO","18","SECRETARIA ADMINISTRATIVA","SECRETARIA ADMINISTRATIVA","CENTRO DE INTEGR ING SOCIEDAD",740616
"TECNICO","13","TECNICO EN ADMINISTRACION DE EMPRESAS","TECNICO CONTABLE","DEPTO. DE FINANZAS Y TESORERIA",843669
"PROFESOR HORAS CLASES","S/G","ACTOR / ACTRIZ","HORAS CLASE","DPTO LINGUISTICA Y LITERATURA",366309
"TECNICO","19","ASISTENTE DE MANTENCION","ASISTENTE DE MANTENCION","UNIDAD BIENESTAR DEL PERSONAL",745045
"PROFESOR HORAS CLASES","S/G","PSICOLOGO","HORAS CLASE","DPTO DE ADMINISTRACION",423661
"PROFESOR HORAS CLASES","S/G","PSICOLOGO","HORAS CLASE","DPTO DE ADMINISTRACION",196432
"PROFESOR HORAS CLASES","S/G","PSICOLOGO","HORAS CLASE","DPTO. GESTION Y POLITICAS PUB.",294648
"ACADEMICOS","4","DOUTOR EM ENGENHARIA ELETRICA","ACADEMICO","DPTO INGENIERIA ELECTRICA",3170986
"PROFESIONALES","10","MAGISTER EN INGENIERIA INFORMATICA","ANALISTA INFORMATICO","DPTO INGENIERIA INFORMATICA",1608333
"TECNICO","17","TECNICO","TECNICO","DEPTO. DE FINANZAS Y TESORERIA",761840
"PROFESOR HORAS CLASES","S/G","MAGISTER EN INGENIERIA INFORMATICA","ANALISTA INFORMATICO","DPTO INGENIERIA INFORMATICA",392866
"PROFESOR HORAS CLASES","S/G","HORAS CLASE","HORAS CLASE","DPTO. TECNOLOGIAS GENERALES",231968
"PROFESIONALES","10","PROFESIONAL","PROFESIONAL","DEPTO. DESARROLLO DE PERSONAS",1475252
"PROFESIONALES","6","PROFESIONAL","PROFESIONAL","VR. VINCULACION CON EL MEDIO",2096648
"PROFESIONALES","8","PERIODISTA","PERIODISTA","DEPARTAMENTO DE ESTUDIOS",2142518
"PROFESOR HORAS CLASES","S/G","INGENIERO CIVIL EN MINAS","HORAS CLASE","DPTO INGENIERIA EN MINAS",429221
"ACADEMICOS","4","DOCTOR EN CIENCIAS DE LA INGENIERIA CON MENCION EN INGENIERIA DE PROCESOS","ACADEMICO","DPTO INGENIERIA ELECTRICA",3213208
"AUXILIARES","23","AUXILIAR","AUXILIAR","DIR. ASISTENCIA JURIDICA",489881
"ADMINISTRATIVO","17","SECRETARIA DE APOYO DOCENTE","SECRETARIA DE APOYO DOCENTE","FACULTAD DE QUIMICA Y BIOLOGIA",736928
"PROFESIONALES","13","PROFESIONAL","PROFESIONAL","DPTO DE GESTIÓN DE LA INFRAEST",1188565
"PROFESOR HORAS CLASES","S/G","CONTADOR PUBLICO Y AUDITOR","HORAS CLASE","DPTO CONTABILIDAD Y AUDITOR",619108
"PROFESOR HORAS CLASES","S/G","HORAS CLASE","HORAS CLASE","DPTO LINGUISTICA Y LITERATURA",314326
"PROFESOR HORAS CLASES","S/G","DOCTOR EN CIENCIAS DE LA INFORMACION","HORAS CLASE","DEPARTAMENTO GESTION AGRARIA",1121866
"ACADEMICOS","6","DOCTOR EN CIENCIAS DE LA MOTRICIDAD HUMANA","ACADEMICO","CARRERA LICEN CS. ACTIV. FISIC",1283494
"PROFESOR HORAS CLASES","S/G","PROFESORA DE EDUCACION MEDIA EN ARTES PLASTICAS","HORAS CLASE","DPTO LINGUISTICA Y LITERATURA",375801
"AUXILIARES","23","AUXILIAR","AUXILIAR","UNIDAD DE GESTION DEL CAMPUS",489881
"PROFESOR HORAS CLASES","S/G","INGENIERO DE EJECUCION EN COMPUTACION E INFORMATICA","HORAS CLASE","DPTO MAT. Y CS. DE LA COMP.",376100
"PROFESOR HORAS CLASES","S/G","PSICOLOGO","HORAS CLASE","UNIDAD PROMOCIÓN DE LA SALUD",618243
"PROFESOR HORAS CLASES","S/G","DOCTOR EN FILOSOFIA CON MENCION EN CIENCIAS FISICAS","HORAS CLASE","DPTO. TECNOLOGIAS INDUSTRIALES",670046
"ACADEMICOS","2","MEDICO CIRUJANO","CONSEJERO FACULTAD","ESCUELA DE MEDICINA",4082544
"ACADEMICOS","4","MASTER EN HISTORIA ARTE ARQUITECTURA Y CIUDAD","DIR ESC DE ARQUITECTURA","ESCUELA DE ARQUITECTURA",4309046
"PROFESOR HORAS CLASES","S/G","INGENIERO DE EJECUCION EN MECANICA","HORAS CLASE","DPTO  INGENIERIA INDUSTRIAL",506312
"PROFESOR HORAS CLASES","S/G","INGENIERO CIVIL EN OBRAS CIVILES","HORAS CLASE","DPTO INGENIERIA OBRAS CIVILES",613095
"PROFESIONALES","14","INGENIERO DE EJECUCION EN ADMINISTRACION DE EMPRESAS","ANALISTA EN GESTION ADM.","DPTO MAT. Y CS. DE LA COMP.",1411006
"ADMINISTRATIVO","16","SECRETARIA EJECUTIVA TRADUCTORA BILINGUE","SECRETARIA DE APOYO DOCENTE","DPTO INGENIERIA EN MINAS",783832
"ADMINISTRATIVO","17","SECRETARIADO COMERCIAL","SECRETARIA ADMINISTRATIVA","DPTO. TECNOLOGIAS GENERALES",819347
"PROFESOR HORAS CLASES","S/G","MATRON","HORAS CLASE","ESCUELA DE OBST Y PUERICULTURA",498311
"ACADEMICOS","8","CONTADOR PUBLICO Y AUDITOR","ACADEMICO","DPTO. DE INVEST. CIENTIFICA",2179708
"PROFESOR HORAS CLASES","S/G","PROFESOR DE EDUCACION GENERAL BASICA","HORAS CLASE","DEPARTAMENTO DE FISICA",870640
"PROFESOR HORAS CLASES","S/G","ENFERMERA","HORAS CLASE","ESCUELA DE ENFERMERIA",759785
"PROFESOR HORAS CLASES","S/G","PSICOLOGO","HORAS CLASE","ESCUELA DE PSICOLOGIA",499641
"TECNICO","18","GASFITER","GASFITER","UNIDAD DE GESTION DEL CAMPUS",912504
"PROFESIONALES","10","SOCIOLOGO","ANALISTA DE CALIDAD","DIRECCIÓN CALIDAD Y SISTEMAS",1560576
"PROFESIONALES","9","CONTADOR AUDITOR","JEFE DE SECCION","UNIDAD BIENESTAR DEL PERSONAL",1746538
"PROFESIONALES","13","TECNOLOGO EN ADMINISTRACION DE PERSONAL","ANALISTA II","UNIDAD DE COORDINACIÓN INSTIT.",1340540
"ADMINISTRATIVO","16","SECRETARIA DE DEPARTAMENTO","SECRETARIA DE DEPARTAMENTO","CECTA",964523
"ADMINISTRATIVO","20","ASISTENTE DE BIBLIOTECA","ASISTENTE DE BIBLIOTECA","FACULTAD DE CIENCIAS MEDICAS",950590
"PROFESIONALES","9","MAGISTER EN EDUCACION CON MENCION EN CURRICULUM Y EVALUACION","JEFE DE LABORATORIO","DPTO. TECNOLOGIAS INDUSTRIALES",1840908
"PROFESOR HORAS CLASES","S/G","MAGISTER EN EDUCACION CON MENCION EN CURRICULUM Y EVALUACION","JEFE DE LABORATORIO","DPTO. TECNOLOGIAS INDUSTRIALES",925451
"ACADEMICOS","6","MAGISTER EN ARQUITECTURA","DIR DEPTO  TECNO GENERALES","DPTO. TECNOLOGIAS GENERALES",4294332
"PROFESOR HORAS CLASES","S/G","SOCIOLOGO","HORAS CLASE","DPTO INGENIERIA INFORMATICA",390039
"PROFESOR HORAS CLASES","S/G","SOCIOLOGO","HORAS CLASE","DPTO INGENIERIA INFORMATICA",261026
"PROFESOR HORAS CLASES","S/G","HORAS CLASE","HORAS CLASE","DPTO INGENIERIA ELECTRICA",577500
"ACADEMICOS","2","MEDICO CIRUJANO","ACADEMICO","ESCUELA DE MEDICINA",3076282
"PROFESOR HORAS CLASES","S/G","HORAS CLASE","HORAS CLASE","DPTO  INGENIERIA INDUSTRIAL",448487
"PROFESOR HORAS CLASES","S/G","HORAS CLASE","HORAS CLASE","DEPTO. DE PUBLICIDAD E IMAGEN",507054
"PROFESOR HORAS CLASES","S/G","MASTER EN ESTADISTICA MATEMATICA","HORAS CLASE","DPTO DE ADMINISTRACION",745980
"PROFESOR HORAS CLASES","S/G","QUIMICO","HORAS CLASE","DPTO. QUIMICA DE LOS MATERIALE",499193
"PROFESOR HORAS CLASES","S/G","MAGISTER ARTIUM EN LA MENCION DE HISTORIA","HORAS CLASE","DEPTO DE HISTORIA",294247
"PROFESOR HORAS CLASES","S/G","QUIMICO FARMACEUTICO","HORAS CLASE","DEPARTAMENTO DE BIOLOGIA",161283
"PROFESOR HORAS CLASES","S/G","DOCTOR EN ESTUDIOS AMERICANOS ESPECIALIDAD PENSAMIENTO Y CULTURA","HORAS CLASE","ESCUELA DE ARQUITECTURA",206009
"PROFESOR HORAS CLASES","S/G","MAGISTER ARTIUM EN LA MENCION DE HISTORIA","HORAS CLASE","DEPTO DE HISTORIA",423260
"PROFESOR HORAS CLASES","S/G","HORAS CLASE","HORAS CLASE","ESCUELA DE OBST Y PUERICULTURA",747417
"PROFESOR HORAS CLASES","S/G","PROFESOR DE ESTADO EN HISTORIA Y GEOGRAFIA","HORAS CLASE","DPTO LINGUISTICA Y LITERATURA",371055
"PROFESOR HORAS CLASES","S/G","MAGISTER EN INNOVACION","HORAS CLASE","DPTO. TECNOLOGIAS GENERALES",872933
"PROFESOR HORAS CLASES","S/G","DOCTOR EN ESTUDIOS AMERICANOS ESPECIALIDAD PENSAMIENTO Y CULTURA","HORAS CLASE","ESCUELA DE ARQUITECTURA",66442
"PROFESOR HORAS CLASES","S/G","MAGISTER EN ASENTAMIENTOS HUMANOS Y MEDIO AMBIENTE","HORAS CLASE","PROGRAMA BACHILLERATO",723750
"PROFESOR HORAS CLASES","S/G","MAGISTER EN ASENTAMIENTOS HUMANOS Y MEDIO AMBIENTE","HORAS CLASE","PROGRAMA BACHILLERATO",440930
"ADMINISTRATIVO","17","ADMINISTRATIVO DE REGISTRO CUR","ADMINISTRATIVO DE REGISTRO CUR","FACULTAD DE CIENCIAS MEDICAS",750339
"PROFESOR HORAS CLASES","S/G","INGENIERO CIVIL EN MINAS","HORAS CLASE","DPTO INGENIERIA EN MINAS",329151
"PROFESIONALES","10","ANALISTA DE GESTION ESTRATEGIC","ANALISTA DE GESTION ESTRATEGIC","DEPTO. DE GESTION ESTRATEGICA",1560576
"PROFESOR HORAS CLASES","S/G","PUBLICISTA CON MENCION EN GESTION CREATIVA","HORAS CLASE","DEPTO. DE PUBLICIDAD E IMAGEN",531668
"PROFESOR HORAS CLASES","S/G","ARQUITECTO","HORAS CLASE","ESCUELA DE ARQUITECTURA",272453
"ACADEMICOS","6","MAGISTER EN CIENCIAS. MENCION ANATOMIA HUMANA","ACADEMICO","VICERRECTORIA ACADÉMICA",1908346
"PROFESOR HORAS CLASES","S/G","PROFESOR DE ESTADO EN FISICA Y MATEMATICA","HORAS CLASE","DEPARTAMENTO DE FISICA",377309
"PROFESOR HORAS CLASES","S/G","PSICOLOGO","HORAS CLASE","ESCUELA DE PSICOLOGIA",252557
"PROFESOR HORAS CLASES","S/G","COMUNICADOR AUDIOVISUAL MENCION VIDEO","HORAS CLASE","DEPTO. DE PUBLICIDAD E IMAGEN",551529
"PROFESOR HORAS CLASES","S/G","PROFESOR DE ESTADO EN MATEMATICA Y COMPUTACION","HORAS CLASE","DPTO MAT. Y CS. DE LA COMP.",883611
"PROFESIONALES","10","ANALISTA DE PROYECTOS I","ANALISTA DE PROYECTOS I","UNIDAD DESARR. PROYECTOS TECN.",1560576
"ADMINISTRATIVO","15","SECRETARIA DE DEPARTAMENTO","SECRETARIA DE DEPARTAMENTO","DEPARTAMENTO DE COMUNICACIONES",918952
"ADMINISTRATIVO","10","SECRETARIA DE RECTOR","SECRETARIA DE RECTOR","RECTORIA",996786
"TECNICO","14","TECNICO EN ADMINISTRACION FINANCIERA","TECNICO CONTABLE","UNIDAD REGIST. ACAD Y CURRICUL",791008
"PROFESOR HORAS CLASES","S/G","PUBLICISTA","HORAS CLASE","DEPTO. DE PUBLICIDAD E IMAGEN",203844
"PROFESOR HORAS CLASES","S/G","PUBLICISTA","HORAS CLASE","DPTO INGENIERIA GEOGRAFICA",261026
"PROFESOR HORAS CLASES","S/G","PUBLICISTA","HORAS CLASE","DEPTO. DE PUBLICIDAD E IMAGEN",332857
"PROFESOR HORAS CLASES","S/G","HORAS CLASE","HORAS CLASE","DPTO INGENIERIA MECANICA",206229
"PROFESIONALES","10","TECNOLOGO EN ADMINISTRACION DE PERSONAL","JEFE ADMINISTRACION Y FINANZAS","DIRECCIÓN DE POSTGRADO",1640170
"ADMINISTRATIVO","20","SECRETARIA(O) C ADMINISTRATIVO","SECRETARIA(O) C ADMINISTRATIVO","FACULTAD DE HUMANIDADES",668120
"PROFESOR HORAS CLASES","S/G","HORAS CLASE","HORAS CLASE","DPTO. QUIMICA DE LOS MATERIALE",622587
"AUXILIARES","21","ESTAFETA","ESTAFETA","DPTO INGENIERIA METALURGICA",853815
"ACADEMICOS","4","TERAPEUTA OCUPACIONAL","DIRECTORA DPTO FORMAC INTEGRAL","VICERRECTORIA ACADÉMICA",3493211
"PROFESIONALES","12","PERIODISTA","PERIODISTA","RADIOEMISORAS",1478860
"PROFESOR HORAS CLASES","S/G","INGENIERO DE EJECUCION EN ELECTRICIDAD","HORAS CLASE","DPTO. TECNOLOGIAS INDUSTRIALES",386401
"PROFESIONALES","8","ASISTENTE SOCIAL","ASIST SOCIAL BIEN ESTUDIANTIL","FACULTAD DE INGENIERÍA",1977425
"PROFESOR HORAS CLASES","S/G","HORAS CLASE","HORAS CLASE","DEPTO DE HISTORIA",406983
"PROFESIONALES","13","MAGISTER EN CIENCIAS QUIMICAS","ENCARGADO DE LABORATORIO","FACULTAD DE QUIMICA Y BIOLOGIA",1353870
"PROFESOR HORAS CLASES","S/G","MEDICO VETERINARIO","HORAS CLASE","ESCUELA DE MEDICINA",686925
"PROFESOR HORAS CLASES","S/G","INGENIERO DE EJECUCION EN QUIMICA","HORAS CLASE","DPTO. TECNOLOGIAS INDUSTRIALES",191994
"ADMINISTRATIVO","10","REGISTRADOR CURRICULAR","REGISTRADOR CURRICULAR","FACULTAD DE CIENCIAS MEDICAS",1120907
"PROFESOR HORAS CLASES","S/G","PROFESOR DE EDUCACION MEDIA EN CASTELLANO","HORAS CLASE","DPTO LINGUISTICA Y LITERATURA",562379
"PROFESOR HORAS CLASES","S/G","DOCTOR OF ENGINEERING SCIENCE","HORAS CLASE","DPTO. TECNOLOGIAS INDUSTRIALES",385293
"PROFESOR HORAS CLASES","S/G","MATRON (A)","HORAS CLASE","ESCUELA DE OBST Y PUERICULTURA",563243
"PROFESOR HORAS CLASES","S/G","DOCTOR OF ENGINEERING SCIENCE","HORAS CLASE","DPTO. TECNOLOGIAS INDUSTRIALES",512557
"PROFESOR HORAS CLASES","S/G","DOCTOR EN QUIMICA","HORAS CLASE","DPTO. CIENCIAS DEL AMBIENTE",506312
"PROFESOR HORAS CLASES","S/G","MAGISTER EN CIENCIA EN LA ESPECIALIDAD DE MATEMATICA","HORAS CLASE","DPTO MAT. Y CS. DE LA COMP.",1241795
"ACADEMICOS","6","DOCTOR EN CIENCIAS CON MENCION EN FISICA","ACADEMICO","DEPARTAMENTO DE FISICA",2671870
"ACADEMICOS","8","MAGISTER EN CIENCIAS DE LA INGENIERIA MENCION CIENCIA E INGENIERIA DE LOS MATERIALES","ACADEMICO","DPTO. DE INVEST. CIENTIFICA",1131782
"PROFESOR HORAS CLASES","S/G","HORAS CLASE","HORAS CLASE","DPTO INGENIERIA INFORMATICA",212497
"PROFESOR HORAS CLASES","S/G","INGENIERO CIVIL DE INDUSTRIAL","HORAS CLASE","DPTO  INGENIERIA INDUSTRIAL",180491
"PROFESOR HORAS CLASES","S/G","INGENIERO CIVIL EN INFORMATICA","HORAS CLASE","DPTO CONTABILIDAD Y AUDITOR",167467
"TECNICO","19","TRABAJADOR SOCIAL CON MENCION EN INTERVENCION SOCIAL","ASISTENTE DE MANTENCION","DEPARTAMENTO DE EXTENSION",278386
"PROFESIONALES","12","PROFESOR DE ESTADO DE HISTORIA Y GEOGRAFIA","ANALISTA","VICERRECTORIA ACADÉMICA",1073055
"ACADEMICOS","6","DOCTOR EN QUIMICA","JEFE CARR TEC ANALIS QCO Y FIS","DPTO. CIENCIAS DEL AMBIENTE",2961751
"PROFESOR HORAS CLASES","S/G","INGENIERO CIVIL ELECTRICISTA","HORAS CLASE","DPTO INGENIERIA ELECTRICA",616967
"PROFESOR HORAS CLASES","S/G","INGENIERO CIVIL ELECTRICISTA","HORAS CLASE","DPTO INGENIERIA ELECTRICA",833647
"PROFESOR HORAS CLASES","S/G","INGENIERO CIVIL EN MECANICA","HORAS CLASE","DPTO INGENIERIA METALURGICA",164375
"PROFESOR HORAS CLASES","S/G","INGENIERO ELECTRONICO","HORAS CLASE","DPTO INGENIERIA ELECTRICA",161283
"PROFESOR HORAS CLASES","S/G","INGENIERO CIVIL EN MECANICA","HORAS CLASE","DPTO INGENIERIA EN MINAS",157694
"PROFESOR HORAS CLASES","S/G","MAGISTER EN ARTE TERAPIA","HORAS CLASE","ESCUELA DE PSICOLOGIA",284651
"PROFESIONALES","14","COMUNICADOR SOCIAL EN MARKETING","PROFESIONAL","CENTRO DE INTEGR ING SOCIEDAD",1284387
"PROFESOR HORAS CLASES","S/G","HORAS CLASE","HORAS CLASE","DPTO INGENIERIA GEOGRAFICA",231968
"PROFESOR HORAS CLASES","S/G","INGENIERO EN ALIMENTOS","HORAS CLASE","DPTO CIENCIA Y TEC.DE LOS ALIM",107481
"PROFESOR HORAS CLASES","S/G","INGENIERIA CIVIL EN QUIMICA","HORAS CLASE","DPTO INGENIERIA QUIMICA",147124
"PROFESOR HORAS CLASES","S/G","INGENIERO EN ALIMENTOS","HORAS CLASE","DPTO CIENCIA Y TEC.DE LOS ALIM",107481
"PROFESOR HORAS CLASES","S/G","PROFESOR DE FISICA","HORAS CLASE","DEPARTAMENTO DE FISICA",1325940
"PROFESOR HORAS CLASES","S/G","HORAS CLASE","HORAS CLASE","ESCUELA DE ARQUITECTURA",1060403
"ACADEMICOS","4","DOCTOR EN HISTORIA MENCION EN HISTORIA DE CHILE","ACADEMICO","DEPTO DE HISTORIA",3297653
"PROFESOR HORAS CLASES","S/G","INGENIERIA CIVIL EN QUIMICA","HORAS CLASE","DPTO INGENIERIA QUIMICA",276137
"PROFESOR HORAS CLASES","S/G","ABOGADO(A)","HORAS CLASE","DPTO. GESTION Y POLITICAS PUB.",258215
"PROFESOR HORAS CLASES","S/G","ENFERMERA","HORAS CLASE","ESCUELA DE ENFERMERIA",559612
"PROFESOR HORAS CLASES","S/G","INGENIERO CIVIL EN INFORMATICA","HORAS CLASE","DPTO INGENIERIA INFORMATICA",651062
"PROFESOR HORAS CLASES","S/G","INGENIERO COMERCIAL","HORAS CLASE","DPTO CONTABILIDAD Y AUDITOR",499641
"PROFESOR HORAS CLASES","S/G","CONTADOR AUDITOR","HORAS CLASE","DPTO CONTABILIDAD Y AUDITOR",647583
"PROFESOR HORAS CLASES","S/G","INGENIERO EN ALIMENTOS","HORAS CLASE","DPTO CIENCIA Y TEC.DE LOS ALIM",343976
"PROFESOR HORAS CLASES","S/G","HORAS CLASE","HORAS CLASE","DPTO INGENIERIA EN MINAS",492074
"PROFESOR HORAS CLASES","S/G","DOCTOR EN ESTUDIOS AMERICANOS ESPECIALIDAD ESTUDIOS INTERNACIONALES","HORAS CLASE","DEPTO DE HISTORIA",370180
"PROFESOR HORAS CLASES","S/G","MAGISTER EN DERECHO. MENCION EN DERECHO INTERNACIONAL","HORAS CLASE","DPTO LINGUISTICA Y LITERATURA",409022
"PROFESOR HORAS CLASES","S/G","MAGISTER EN ADMINISTRACION (MBA) CON MENCION GESTION EN FINANZAS","HORAS CLASE","DPTO  INGENIERIA INDUSTRIAL",499193
"PROFESOR HORAS CLASES","S/G","DOCTOR EN ESTUDIOS AMERICANOS ESPECIALIDAD ESTUDIOS INTERNACIONALES","HORAS CLASE","DEPTO DE HISTORIA",314103
"PROFESOR HORAS CLASES","S/G","PROFESOR DE INGLES","HORAS CLASE","DPTO LINGUISTICA Y LITERATURA",488496
"PROFESOR HORAS CLASES","S/G","PROFESOR DE INGLES","HORAS CLASE","DPTO LINGUISTICA Y LITERATURA",456767
"PROFESIONALES","11","INGENIERO DE EJECUCION EN ALIMENTOS","ENCARGADO DE LABORATORIO","DPTO CIENCIA Y TEC.DE LOS ALIM",1677011
"TECNICO","20","ASISTENTE TECNICO IMPRESIONES","ASISTENTE TECNICO IMPRESIONES","DEPARTAMENTO DE COMUNICACIONES",678614
"TECNICO","9","TECNICO SUPERIOR EN ELECTRONICA CON MENCION EN MICROCOMPUTADORES","TEC. DE SOPORTE Y ESPECIALIDAD","RADIOEMISORAS",1084285
"AUXILIARES","21","AUXILIAR DE SERVICIOS","AUXILIAR DE SERVICIOS","DPTO  INGENIERIA INDUSTRIAL",853815
"ADMINISTRATIVO","16","SECRETARIA DE CENTRO","SECRETARIA DE CENTRO","CENTRO INNOV. Y TRANSFER.TECN",795741
"PROFESIONALES","13","EDUCADORA DE PARVULOS","EDUCADOR DE PARVULOS","UNIDAD BIENESTAR DEL PERSONAL",1510209
"ADMINISTRATIVO","14","ADMINISTRATIVO","ADMINISTRATIVO","DEPTO. DE PUBLICIDAD E IMAGEN",1020191
"AUXILIARES","21","AUXILIAR DE SERVICIOS","AUXILIAR DE SERVICIOS","PROGRAMA BACHILLERATO",823322
"PROFESIONALES","8","INGENIERO CIVIL DE INDUSTRIAL","ASESOR DE RECTORIA","RECTORIA",1786514
"PROFESIONALES","10","PSICOLOGO","ANALISTA DE LA CALIDAD","DIRECCIÓN CALIDAD Y SISTEMAS",1560576
"PROFESIONALES","11","BIOTECNOLOGO MENCION GESTION TECNOLOGICA","PROFESIONAL","VR INVEST. DESARR E INNOVACION",1481444
"PROFESIONALES","11","TECNOLOGO EN ADMINISTRACION DE PERSONAL","PROFESIONAL","DEPARTAMENTO DE COMUNICACIONES",1718566
"ADMINISTRATIVO","17","TRABAJADOR SOCIAL","ADMINISTRATIVO DE PROCESO","FACULTAD DE INGENIERÍA",593503
"PROFESIONALES","6","INGENIERO CIVIL INDUSTRIAL","ASESOR","CENTRO DE INTEGR ING SOCIEDAD",2219327
"ADMINISTRATIVO","15","SECRETARIA DE APOYO DOCENTE","SECRETARIA DE APOYO DOCENTE","DPTO INGENIERIA QUIMICA",968340
"TECNICO","17","AUXILIAR DE ENFERMERIA","AUXILIAR DE ENFERMERIA","CENTRO DE SALUD",738838
"AUXILIARES","23","ESTAFETA","ESTAFETA","DEPARTAMENTO DE COMUNICACIONES",638791
"PROFESOR HORAS CLASES","S/G","INGENIERO CIVIL INDUSTRIAL","ASESOR","DPTO  INGENIERIA INDUSTRIAL",265772
"PROFESOR HORAS CLASES","S/G","INGENIERO DE EJECUCION EN ALIMENTOS","ENCARGADO DE LABORATORIO","DPTO CIENCIA Y TEC.DE LOS ALIM",607475
"PROFESOR HORAS CLASES","S/G","DOTTORE IN PEDAGOGIA CON LODE","HORAS CLASE","DEPARTAMENTO DE EDUCACIÓN",261026
"PROFESOR HORAS CLASES","S/G","DOTTORE IN PEDAGOGIA CON LODE","HORAS CLASE","DEPARTAMENTO DE EDUCACIÓN",528730
"PROFESOR HORAS CLASES","S/G","BACHAREL EN LETRAS","HORAS CLASE","DPTO LINGUISTICA Y LITERATURA",393182
"PROFESIONALES","12","TECNOLOGO EN CONSTRUCCIONES","PROYECTISTA SANITARIO","UNIDAD DE CONSTRUCCIÓN",1492986
"PROFESOR HORAS CLASES","S/G","TECNOLOGO EN TELECOMUNICACIONES","HORAS CLASE","DPTO. TECNOLOGIAS INDUSTRIALES",803787
"PROFESOR HORAS CLASES","S/G","HORAS CLASE","HORAS CLASE","DPTO  INGENIERIA INDUSTRIAL",170195
"TECNICO","20","MUSICO","MUSICO","DEPARTAMENTO DE EXTENSION",741578
"PROFESOR HORAS CLASES","S/G","HORAS CLASE","HORAS CLASE","DPTO INGENIERIA QUIMICA",286940
"PROFESOR HORAS CLASES","S/G","HORAS CLASE","HORAS CLASE","DPTO INGENIERIA QUIMICA",236539
"PROFESOR HORAS CLASES","S/G","INGENIERO DE EJECUCION EN MECANICA","HORAS CLASE","DPTO INGENIERIA MECANICA",515094
"PROFESIONALES","8","ABOGADO(A)","ABOGADO","DIR. ASISTENCIA JURIDICA",1786514
"TECNICO","17","AUXILIAR DE ENFERMERIA","AUXILIAR DE ENFERMERIA","CENTRO DE SALUD",727336
"PROFESOR HORAS CLASES","S/G","MEDICO CIRUJANO","HORAS CLASE","ESCUELA DE MEDICINA",482851
"PROFESOR HORAS CLASES","S/G","DOCTOR EN ARQUITECTURA Y PATRIMONIO CULTURAL-AMBIENTAL(INVEST. REFLEX. ACCION)","HORAS CLASE","DEPTO DE HISTORIA",251534
"PROFESOR HORAS CLASES","S/G","ADMINISTRADOR DE EMPRESAS","HORAS CLASE","DPTO. TECNOLOGIAS GENERALES",200166
"PROFESOR HORAS CLASES","S/G","DOCTOR EN ARQUITECTURA Y PATRIMONIO CULTURAL-AMBIENTAL(INVEST. REFLEX. ACCION)","HORAS CLASE","DEPTO DE HISTORIA",632078
"PROFESOR HORAS CLASES","S/G","LICENCIADO EN MATEMATICAS","HORAS CLASE","DPTO MAT. Y CS. DE LA COMP.",507054
"PROFESOR HORAS CLASES","S/G","HORAS CLASE","HORAS CLASE","DPTO MAT. Y CS. DE LA COMP.",378041
"ADMINISTRATIVO","17","ADMINISTRATIVO DE PROCESO","ADMINISTRATIVO DE PROCESO","DPTO. DE RECURSOS HUMANOS",715835
"TECNICO","18","TECNICO EN MAQUINAS OFFSETT","TECNICO EN MAQUINAS OFFSETT","DPTO INGENIERIA MECANICA",912504
"ACADEMICOS","4","DOCTOR OF ECONOMICS","ACADEMICO","DPTO. DE INVEST. CIENTIFICA",3128763
"ADMINISTRATIVO","12","ADMINISTRATIVO ESPECIALES","ADMINISTRATIVO ESPECIALES","SELLO EDITORIAL",871747
"PROFESOR HORAS CLASES","S/G","PROFESOR DE ESTADO EN MATEMATICA Y COMPUTACION","HORAS CLASE","DPTO MAT. Y CS. DE LA COMP.",1155088
"PROFESOR HORAS CLASES","S/G","MAGISTER EN FILOSOFIA","HORAS CLASE","DEPARTAMENTO DE FILOSOFÍA",314326
"PROFESOR HORAS CLASES","S/G","DOCTOR OF PHILOSOPHY","HORAS CLASE","DPTO INGENIERIA GEOGRAFICA",305674
"PROFESIONALES","14","TECNOLOGO EN CONTROL INDUSTRIAL","ANALISTA","UNIDAD DE ADQUISICIONES",1233105
"PROFESOR HORAS CLASES","S/G","INGENIERO CIVIL EN GEOGRAFIA","HORAS CLASE","DPTO INGENIERIA GEOGRAFICA",512325
"PROFESOR HORAS CLASES","S/G","QUIMICO FARMACEUTICO","HORAS CLASE","DEPARTAMENTO DE BIOLOGIA",1207599
"PROFESOR HORAS CLASES","S/G","INGENIERO CIVIL DE INDUSTRIAS CON MENCION EN ELECTRICIDAD","HORAS CLASE","DPTO MAT. Y CS. DE LA COMP.",554730
"ACADEMICOS","6","PERIODISTA","JEFE CARRERA DE PERIODISMO","VICERRECTORIA ACADÉMICA",2925591
"ACADEMICOS","6","INGENIERO EN ALIMENTOS","ACADEMICO","DPTO. DE INVEST. CIENTIFICA",2635711
"PROFESOR HORAS CLASES","S/G","INGENIERO CIVIL DE INDUSTRIAS CON MENCION EN ELECTRICIDAD","HORAS CLASE","DPTO MAT. Y CS. DE LA COMP.",771209
"PROFESOR HORAS CLASES","S/G","PROFESOR DE ESTADO DE MATEMATICAS Y ESTADISTICA","HORAS CLASE","DPTO MAT. Y CS. DE LA COMP.",455606
"PROFESOR HORAS CLASES","S/G","PROFESOR DE ESTADO DE MATEMATICAS Y ESTADISTICA","HORAS CLASE","DPTO MAT. Y CS. DE LA COMP.",151869
"ACADEMICOS","6","DOCTOR EN CIENCIAS DE RECURSOS NATURALES","ACADEMICO","DPTO. QUIMICA DE LOS MATERIALE",2961751
"PROFESOR HORAS CLASES","S/G","INGENIERO CIVIL EN GEOGRAFIA","HORAS CLASE","DPTO INGENIERIA GEOGRAFICA",946808
"PROFESOR HORAS CLASES","S/G","INGENIERO CIVIL ELECTRONICO","HORAS CLASE","DPTO INGENIERIA ELECTRICA",444399
"PROFESOR HORAS CLASES","S/G","PROFESOR DE ESTADO DE MATEMATICAS Y ESTADISTICA","HORAS CLASE","DPTO MAT. Y CS. DE LA COMP.",614156
"PROFESIONALES","13","SOCIOLOGO","ANALISTA BASE DE DATOS","UNIDAD REGIST. ACAD Y CURRICUL",1273889
"PROFESOR HORAS CLASES","S/G","PROFESOR DE ESTADO DE INGLES","HORAS CLASE","DPTO LINGUISTICA Y LITERATURA",670116
"PROFESOR HORAS CLASES","S/G","INGENIERO CIVIL MECANICO","HORAS CLASE","DPTO INGENIERIA MECANICA",180491
"PROFESOR HORAS CLASES","S/G","PROFESOR DE ESTADO EN MATEMATICA Y COMPUTACION","HORAS CLASE","DPTO MAT. Y CS. DE LA COMP.",315166
"PROFESOR HORAS CLASES","S/G","HORAS CLASE","HORAS CLASE","DPTO INGENIERIA MECANICA",186852
"PROFESIONALES","8","PROFESOR DE EDUCACION MEDIA EN MATEMATICAS Y FÍSICA","JEFE DE AREA","VICERRECTORIA ACADÉMICA",1271448
