"Estamento","Grado","Titulo.Oficio","Funcion.Cargo","Unidad","BrutoHaber"
"ADMINISTRATIVO","15","SECRETARIA ADMINISTRATIVA","SECRETARIA ADMINISTRATIVA","UNIDAD DE BIBLIOTECAS",918952
"PROFESOR HORAS CLASES","S/G","MAGISTER EN EDUCACION MENCION ORIENTACION EDUCACIONAL","HORAS CLASE","DEPARTAMENTO DE EDUCACIÓN",600416
"PROFESOR HORAS CLASES","S/G","INGENIERO CIVIL EN QUIMICA","HORAS CLASE","DPTO INGENIERIA QUIMICA",540944
"PROFESOR HORAS CLASES","S/G","MAGISTER EN EDUCACION MENCION ORIENTACION EDUCACIONAL","HORAS CLASE","DEPARTAMENTO DE EDUCACIÓN",329151
"PROFESOR HORAS CLASES","S/G","PROFESOR DE ESTADO EN INGLES","HORAS CLASE","DPTO LINGUISTICA Y LITERATURA",796889
"AUXILIARES","23","AUXILIAR DE SERVICIOS","AUXILIAR DE SERVICIOS","FACULTAD DE QUIMICA Y BIOLOGIA",629106
"PROFESIONALES","10","SOCIOLOGO","ANALISTA DE LA CALIDAD","DIRECCIÓN CALIDAD Y SISTEMAS",1475252
"ADMINISTRATIVO","21","ADMINISTRATIVO","ADMINISTRATIVO","DIRECCIÓN CALIDAD Y SISTEMAS",692308
"PROFESOR HORAS CLASES","S/G","PROFESOR DE ESTADO EN MATEMATICA Y COMPUTACION","HORAS CLASE","DPTO MAT. Y CS. DE LA COMP.",1155088
"ACADEMICOS","6","PERIODISTA","SECRETARIO FACULTAD DE DERECHO","FACULTAD DE DERECHO",3235246
"PROFESIONALES","8","INGENIERO EN GESTION INFORMATICA","PROFESIONAL","FACULTAD DE INGENIERÍA",1930518
"ACADEMICOS","4","DOCTOR EN ESTUDIOS AMERICANOS EN LA MENCION PENSAMIENTO Y CULTURA","ACADEMICO","INSTITUTO DE ESTUDIOS AVANZADO",3107652
"PROFESOR HORAS CLASES","S/G","HORAS CLASE","HORAS CLASE","DPTO LINGUISTICA Y LITERATURA",530974
"PROFESOR HORAS CLASES","S/G","HORAS CLASE","HORAS CLASE","DPTO LINGUISTICA Y LITERATURA",160786
"PROFESIONALES","6","ABOGADO(A)","ABOGADO","DIR. ASISTENCIA JURIDICA",2117094
"PROFESOR HORAS CLASES","S/G","INGENIERO COMERCIAL EN ECONOMIA","HORAS CLASE","DPTO CONTABILIDAD Y AUDITOR",371055
"PROFESOR HORAS CLASES","S/G","MAGISTER EN ESTUDIOS SOCIALES Y POLITICOS LATINOAMERICANOS","HORAS CLASE","ESCUELA DE PSICOLOGIA",256280
"PROFESOR HORAS CLASES","S/G","QUIMICO","HORAS CLASE","DPTO. QUIMICA DE LOS MATERIALE",300208
"PROFESOR HORAS CLASES","S/G","QUIMICO","HORAS CLASE","DPTO. QUIMICA DE LOS MATERIALE",529291
"PROFESOR HORAS CLASES","S/G","CONTADOR AUDITOR","HORAS CLASE","DPTO CONTABILIDAD Y AUDITOR",869373
"PROFESOR HORAS CLASES","S/G","INGENIERO DE EJECUCION EN GEOMENSURA","HORAS CLASE","DPTO INGENIERIA GEOGRAFICA",747936
"PROFESOR HORAS CLASES","S/G","MAGISTER EN ESTUDIOS SOCIALES Y POLITICOS LATINOAMERICANOS","HORAS CLASE","DEPTO DE HISTORIA",633346
"ACADEMICOS","6","DOCTOR EN QUIMICA INORGÁNICA MOLECULAR","ACADEMICO","DPTO. QUIMICA DE LOS MATERIALE",2653790
"PROFESIONALES","10","SOCIOLOGO","ANALISTA DE GESTION I","DIR.  DESARROLLO INSTITUCIONAL",1560576
"PROFESIONALES","12","INGENIERO DE EJECUCION EN TEXTIL","ENCARGADO DE LABORATORIO","DPTO INGENIERIA QUIMICA",846616
"ADMINISTRATIVO","20","ADMINISTRATIVO DE APOYO","ADMINISTRATIVO DE APOYO","DPTO. PLANFIC Y PRESUPUESTARIA",710096
"PROFESIONALES","10","MAGISTER EN GESTION CULTURAL APLICADA: POLITICAS Y GESTION DE INSTITUCIONES CULTURALES","JEFE DE SECCION","UNIDAD DE VOCACION ARTISTICA",862011
"ADMINISTRATIVO","20","ASISTENTE DE BIBLIOTECA","ASISTENTE DE BIBLIOTECA","UNIDAD DE BIBLIOTECAS",669557
"PROFESOR HORAS CLASES","S/G","MAGISTER EN GESTION CULTURAL APLICADA: POLITICAS Y GESTION DE INSTITUCIONES CULTURALES","JEFE DE SECCION","UNIDAD DE VOCACION ARTISTICA",1044099
"PROFESOR HORAS CLASES","S/G","MAGISTER EN HISTORIA EN LA MENCION DE HISTORIA DE CHILE","HORAS CLASE","DEPTO DE HISTORIA",253469
"PROFESOR HORAS CLASES","S/G","HORAS CLASE","HORAS CLASE","DPTO INGENIERIA INFORMATICA",343160
"PROFESOR HORAS CLASES","S/G","DOCTOR EN GEOGRAFIA. PLANIFICACION TERRITORIAL Y GESTION AMBIENTAL","HORAS CLASE","PROGRAMA BACHILLERATO",608216
"PROFESOR HORAS CLASES","S/G","HORAS CLASE","HORAS CLASE","DPTO INGENIERIA QUIMICA",401961
"PROFESOR HORAS CLASES","S/G","INGENIERO CIVIL EN OBRAS CIVILES","HORAS CLASE","DPTO INGENIERIA OBRAS CIVILES",573741
"PROFESOR HORAS CLASES","S/G","INGENIERO CIVIL EN MINAS","HORAS CLASE","DPTO INGENIERIA EN MINAS",375801
"PROFESOR HORAS CLASES","S/G","INGENIERO COMERCIAL","HORAS CLASE","DPTO CIENCIA Y TEC.DE LOS ALIM",380780
"PROFESOR HORAS CLASES","S/G","HORAS CLASE","HORAS CLASE","DPTO LINGUISTICA Y LITERATURA",799582
"PROFESOR HORAS CLASES","S/G","PROFESOR DE INGLES","HORAS CLASE","DPTO. GESTION Y POLITICAS PUB.",286690
"PROFESOR HORAS CLASES","S/G","HORAS CLASE","HORAS CLASE","DPTO  INGENIERIA INDUSTRIAL",370190
"PROFESOR HORAS CLASES","S/G","PROFESOR DE INGLES","HORAS CLASE","DPTO. GESTION Y POLITICAS PUB.",280009
"PROFESOR HORAS CLASES","S/G","MAGISTER EN LINGÜÍSTICA MENCION SOCIOLINGUISTICA HISPONOAMERICANA","HORAS CLASE","DPTO LINGUISTICA Y LITERATURA",329151
"PROFESOR HORAS CLASES","S/G","HORAS CLASE","HORAS CLASE","DPTO DE ECONOMIA",484955
"ACADEMICOS","6","MASTER UNIVERSITARIO DI I LIVELLO IN DESIGN PER LO SVILUPPO DEL PRODOTTO INDUSTRIALE","ACADEMICO","DPTO. TECNOLOGIAS GENERALES",2884120
"PROFESOR HORAS CLASES","S/G","DOCTOR EN GEOGRAFIA. PLANIFICACION TERRITORIAL Y GESTION AMBIENTAL","HORAS CLASE","PROGRAMA BACHILLERATO",652562
"ACADEMICOS","6","ADMINISTRADOR PUBLICO","JEFE DE CARRERA ADM. PUBLICA","DPTO. GESTION Y POLITICAS PUB.",2997910
"PROFESOR HORAS CLASES","S/G","PUBLICISTA","HORAS CLASE","DEPTO. DE PUBLICIDAD E IMAGEN",314326
"PROFESOR HORAS CLASES","S/G","INGENIERO COMERCIAL","HORAS CLASE","DPTO  INGENIERIA INDUSTRIAL",628832
"PROFESOR HORAS CLASES","S/G","PUBLICISTA","HORAS CLASE","DEPTO. DE PUBLICIDAD E IMAGEN",360888
"PROFESOR HORAS CLASES","S/G","HORAS CLASE","HORAS CLASE","FACULTAD DE CIENCIAS MEDICAS",620643
"PROFESIONALES","10","CONTADOR PUBLICO Y AUDITOR","AUDITOR I","CONTRALORIA UNIVERSITARIA",1560576
"AUXILIARES","21","MAYORDOMO","MAYORDOMO","CENTRO FELIX KLEIN",664213
"AUXILIARES","19","AUXILIAR DE SERVICIOS","AUXILIAR DE SERVICIOS","INSTITUTO DE ESTUDIOS AVANZADO",723556
"ADMINISTRATIVO","15","SECRETARIA DE APOYO DOCENTE","SECRETARIA DE APOYO DOCENTE","DPTO MAT. Y CS. DE LA COMP.",968340
"ADMINISTRATIVO","17","SECRETARIA DE DIRECCION","SECRETARIA DE DIRECCION","DIRECCIÓN DE POSTGRADO",732132
"PROFESIONALES","6","INGENIERO CIVIL EN INFORMATICA","PROFESIONAL","UNIDAD REGIST. ACAD Y CURRICUL",2188661
"PROFESIONALES","10","INGENIERO DE EJECUCION EN MINAS","RESPONSABLE TEC TEMP Y PRESION","DPTO INGENIERIA ELECTRICA",1576495
"ADMINISTRATIVO","18","ADMINISTRATIVO DE REGISTRO CUR","ADMINISTRATIVO DE REGISTRO CUR","FACULTAD DE ADMINIST Y ECONOMI",751724
"PROFESIONALES","10","PERIODISTA","PROFESIONAL","DEPARTAMENTO DE COMUNICACIONES",1475252
"PROFESOR HORAS CLASES","S/G","INGENIERO CIVIL EN INFORMATICA","PROFESIONAL","DPTO MAT. Y CS. DE LA COMP.",146686
"PROFESOR HORAS CLASES","S/G","INGENIERO CIVIL EN INFORMATICA","PROFESIONAL","DPTO MAT. Y CS. DE LA COMP.",560016
"PROFESOR HORAS CLASES","S/G","INGENIERO CIVIL EN INFORMATICA","PROFESIONAL","DPTO MAT. Y CS. DE LA COMP.",140005
"PROFESOR HORAS CLASES","S/G","ADMINISTRADOR PUBLICO","HORAS CLASE","DPTO. GESTION Y POLITICAS PUB.",109636
"AUXILIARES","21","MAYORDOMO","MAYORDOMO","FACULTAD DE CIENCIAS MEDICAS",682144
"PROFESIONALES","14","BIBLIOTECARIO DOCUMENTALISTA","BIBLIOTECARIO","FACULTAD DE HUMANIDADES",1245925
"PROFESOR HORAS CLASES","S/G","PERIODISTA","HORAS CLASE","ESCUELA DE PERIODISMO",377309
"PROFESIONALES","8","ABOGADO(A)","ABOGADO","CONTRALORIA UNIVERSITARIA",1878343
"PROFESOR HORAS CLASES","S/G","PSICOLOGO","HORAS CLASE","DPTO. TECNOLOGIAS GENERALES",375801
"PROFESOR HORAS CLASES","S/G","PUBLICISTA","HORAS CLASE","DEPTO. DE PUBLICIDAD E IMAGEN",651062
"ACADEMICOS","4","DOCTOR OF PHILOSOPHY IN TECHNICAL SCIENCES","ACADEMICO","DPTO INGENIERIA METALURGICA",3192097
"ADMINISTRATIVO","17","SECRETARIA DE DIRECCION","SECRETARIA DE DIRECCION","DPTO INGENIERIA METALURGICA",727336
"PROFESOR HORAS CLASES","S/G","PSICOLOGA","HORAS CLASE","ESCUELA DE PSICOLOGIA",231968
"ACADEMICOS","4","DOCTOR EN MICROBIOLOGIA","ACADEMICO","DEPARTAMENTO DE BIOLOGIA",3107652
"ADMINISTRATIVO","15","SECRETARIO B","SECRETARIO B","DPTO INGENIERIA QUIMICA",844560
"AUXILIARES","21","ESTAFETA","ESTAFETA","ESCUELA DE MEDICINA",773625
"TECNICO","18","TECNICO EN BIBLIOTECAS","TECNICO EN BIBLIOTECAS","UNIDAD DE BIBLIOTECAS",718399
"ADMINISTRATIVO","17","ADMINISTRATIVO DE APOYO","ADMINISTRATIVO DE APOYO","DPTO MAT. Y CS. DE LA COMP.",727336
"PROFESIONALES","10","INGENIERO FISICO","ANALISTA DE GESTION I","DIRECCIÓN DE POSTGRADO",1560576
"ADMINISTRATIVO","12","ADMINISTRATIVO ESPECIALES","ADMINISTRATIVO ESPECIALES","DEPTO. BENEFICIOS ESTUDIANTILE",1034456
"PROFESIONALES","6","PSICOLOGO CLINICO","PSICOLOGO CLINICO","ESCUELA DE PSICOLOGIA",577347
"PROFESOR HORAS CLASES","S/G","ENFERMERA","HORAS CLASE","ESCUELA DE ENFERMERIA",833994
"PROFESOR HORAS CLASES","S/G","PROFESOR DE ESPAÑOL","HORAS CLASE","DPTO LINGUISTICA Y LITERATURA",562379
"PROFESOR HORAS CLASES","S/G","INGENIERO CIVIL DE INDUSTRIAS","HORAS CLASE","DPTO. TECNOLOGIAS INDUSTRIALES",243977
"ACADEMICOS","4","DOCTOR EN CIENCIAS CON MENCION EN FISICA","ACADEMICO","DEPARTAMENTO DE FISICA",3107652
"PROFESOR HORAS CLASES","S/G","PROFESOR DE INGLES","HORAS CLASE","DPTO LINGUISTICA Y LITERATURA",929568
"ADMINISTRATIVO","15","SECRETARIA EJECUTIVA GERENCIAL","SECRETARIA ADMINISTRATIVA","DEPARTAMENTO DE EDUCACIÓN",832213
"ADMINISTRATIVO","12","ADMINISTRATIVO UNICIT","ADMINISTRATIVO UNICIT","UNIDAD DE PROYECTO UNICYT",843494
"TECNICO","20","TECNICO","TECNICO","FACULTAD DE QUIMICA Y BIOLOGIA",689108
"PROFESIONALES","8","INGENIERÍA DE EJECUCIÓN AGRÍCOLA CON MENCIÓN EN GANADERÍA","ANALISTA GEST. II COORD UNICIT","UNIDAD DE PROYECTO UNICYT",2016514
"PROFESOR HORAS CLASES","S/G","ADMINISTRADOR PUBLICO","HORAS CLASE","DPTO. GESTION Y POLITICAS PUB.",592297
"PROFESOR HORAS CLASES","S/G","HORAS CLASE","HORAS CLASE","DPTO MAT. Y CS. DE LA COMP.",1078194
"PROFESOR HORAS CLASES","S/G","MAGISTER EN HISTORIA","HORAS CLASE","DEPTO DE HISTORIA",613095
"PROFESOR HORAS CLASES","S/G","MAGISTER EN ADMINISTRACION Y DIRECCION DE RRHH.","HORAS CLASE","PROGRAMA BACHILLERATO",818434
"ADMINISTRATIVO","17","OPERADOR DE CALDERA","OPERADOR DE CALDERA","DEPARTAMENTO DE DEPORTES",938051
"ADMINISTRATIVO","17","ADMINISTRATIVO REMUNERACIONES","ADMINISTRATIVO REMUNERACIONES","DPTO. DE RECURSOS HUMANOS",727336
"PROFESIONALES","8","TECNOLOGO EN ADMINISTRACION DE PERSONAL","JEFE DE SECCION","DEPTO. DESARROLLO DE PERSONAS",1912518
"ADMINISTRATIVO","17","SECRETARIA DE APOYO DOCENTE","SECRETARIA DE APOYO DOCENTE","ESCUELA DE MEDICINA",738838
"PROFESOR HORAS CLASES","S/G","HORAS CLASE","HORAS CLASE","DPTO LINGUISTICA Y LITERATURA",1078194
"AUXILIARES","23","AUXILIAR","AUXILIAR","UNIDAD DE GESTION DEL CAMPUS",489881
"PROFESOR HORAS CLASES","S/G","TERAPEUTA OCUPACIONAL","HORAS CLASE","FACULTAD DE CIENCIAS MEDICAS",161283
"ADMINISTRATIVO","16","ADMINISTRATIVO DE PROCESO","ADMINISTRATIVO DE PROCESO","UNIDAD DE PROYECTO UNICYT",760015
"PROFESIONALES","13","MEDICO VETERINARIO","ANALISTA GEST. II COORD UNICIT","UNIDAD DE PROYECTO UNICYT",1503889
"PROFESOR HORAS CLASES","S/G","INGENIERO CIVIL","HORAS CLASE","DPTO INGENIERIA OBRAS CIVILES",562379
"PROFESOR HORAS CLASES","S/G","INGENIERO DE EJECUCION EN GEOMENSURA","HORAS CLASE","DPTO INGENIERIA GEOGRAFICA",295770
"PROFESOR HORAS CLASES","S/G","PROFESOR DE ESTADO EN MATEMATICA Y COMPUTACION","HORAS CLASE","DPTO MAT. Y CS. DE LA COMP.",570381
"ACADEMICOS","6","MAGISTER EN NEUROCIENCIA","ACADEMICO","VICERRECTORIA ACADÉMICA",2635711
"ADMINISTRATIVO","15","SECRETARIA ADMINISTRATIVA","SECRETARIA ADMINISTRATIVA","DEPARTAMENTO DE EDUCACIÓN",955993
"AUXILIARES","21","MAYORDOMO","MAYORDOMO","ESCUELA DE ARQUITECTURA",651650
"PROFESIONALES","8","TECNOLOGO EN ADMINISTRACION DE PERSONAL","JEFE DE AREA","UNIDAD DE ADQUISICIONES",1822515
"TECNICO","19","AUXILIAR DE SERVICIOS","AUXILIAR DE SERVICIOS","DEPTO DE CALIDAD VIDA ESTUDIAN",891441
"PROFESIONALES","14","INGENIERO DE EJECUCION EN INDUSTRIA","ANALISTA DE PROYECTOS","DPTO DE GESTIÓN DE LA INFRAEST",1233105
"PROFESIONALES","8","PROFESOR DE EDUCACION MEDIA EN FISICA Y CIENCIAS NATURALES","PROFESIONAL","DIRECCIÓN CALIDAD Y SISTEMAS",1998216
"PROFESOR HORAS CLASES","S/G","PROFESOR DE EDUCACION MEDIA EN FISICA Y CIENCIAS NATURALES","PROFESIONAL","DPTO. TECNOLOGIAS INDUSTRIALES",546675
"PROFESOR HORAS CLASES","S/G","ABOGADO(A)","HORAS CLASE","FACULTAD DE CIENCIAS MEDICAS",99337
"TECNICO","17","TECNICO","TECNICO","ESCUELA DE MEDICINA",727336
"PROFESIONALES","5","INGENIERO COMERCIAL EN ADMINISTRACION DE EMPRESAS","ANALISTA DE LA CALIDAD","DIRECCIÓN CALIDAD Y SISTEMAS",2368399
"PROFESOR HORAS CLASES","S/G","HORAS CLASE","HORAS CLASE","DPTO MAT. Y CS. DE LA COMP.",974846
"PROFESOR HORAS CLASES","S/G","ESPECIALISTA EN PSIQUIATRIA","HORAS CLASE","ESCUELA DE MEDICINA",257134
"PROFESIONALES","10","TECNOLOGO EN CONTROL INDUSTRIAL","ANALISTA DE LA CALIDAD","DIRECCIÓN CALIDAD Y SISTEMAS",1576495
"PROFESIONALES","14","PROFESOR DE ESTADO EN MATEMATICA Y COMPUTACION","ENCARGADO DE LABORATORIO","DPTO  INGENIERIA INDUSTRIAL",1462288
"ACADEMICOS","2","DOCTOR EN  CIENCIAS DE LA INGENIERIA MENCION CIENCIAS DE LOS MATERIALES","ACADEMICO","DPTO INGENIERIA METALURGICA",3907440
"ACADEMICOS","4","MASTER OF ENGINEERING","ACADEMICO","DPTO INGENIERIA EN MINAS",3382099
"TECNICO","19","ASISTENTE DE LABORATORIO","ASISTENTE DE LABORATORIO","CEUS LLANQUIHUE USACH",734300
"AUXILIARES","22","ESTAFETA","ESTAFETA","DPTO LINGUISTICA Y LITERATURA",656929
"PROFESOR HORAS CLASES","S/G","DISEÑADOR(A) INDUSTRIAL","HORAS CLASE","DPTO. TECNOLOGIAS GENERALES",959546
"PROFESOR HORAS CLASES","S/G","DOCTOR EN DERECHO","HORAS CLASE","DEPARTAMENTO DE FISICA",481271
"PROFESOR HORAS CLASES","S/G","CONTADOR PUBLICO Y AUDITOR","HORAS CLASE","DPTO CONTABILIDAD Y AUDITOR",47863
"PROFESOR HORAS CLASES","S/G","HORAS CLASE","HORAS CLASE","DEPARTAMENTO DE EDUCACIÓN",684954
"PROFESOR HORAS CLASES","S/G","MEDICO CIRUJANO","HORAS CLASE","ESCUELA DE MEDICINA",526485
"PROFESOR HORAS CLASES","S/G","INGENIERO CIVIL EN ELECTRICIDAD","HORAS CLASE","DPTO INGENIERIA ELECTRICA",428544
"PROFESOR HORAS CLASES","S/G","INGENIERO DE EJECUCION EN PREVENCION DE RIESGOS","HORAS CLASE","DPTO. TECNOLOGIAS INDUSTRIALES",840898
"PROFESIONALES","12","INGENIERO DE EJECUCION EN AMBIENTE","ENCARGADO DE LABORATORIO","DPTO INGENIERIA GEOGRAFICA",1765366
"ADMINISTRATIVO","17","INGENIERO EN ADMINISTRACION DE EMPRESAS CON MENCION FINANZAS","ADMINISTRATIVO DE RECURSOS HUM","DPTO. DE RECURSOS HUMANOS",715835
"PROFESOR HORAS CLASES","S/G","INGENIERO DE EJECUCION EN AMBIENTE","ENCARGADO DE LABORATORIO","DPTO INGENIERIA GEOGRAFICA",560016
"PROFESOR HORAS CLASES","S/G","ARQUITECTO","HORAS CLASE","ESCUELA DE ARQUITECTURA",385293
"ACADEMICOS","4","DOCTORIS PHILOSOPHIAE GRADVM","VICEDECANO INVEST FAC DE HUMAN","DEPARTAMENTO DE FILOSOFÍA",4224601
"ACADEMICOS","6","QUIMICO FARMACEUTICO","ACADEMICO","VICERRECTORIA ACADÉMICA",2617631
"PROFESOR HORAS CLASES","S/G","ADMINISTRADOR DE INDUSTRIAS","HORAS CLASE","DPTO. TECNOLOGIAS GENERALES",699480
"PROFESOR HORAS CLASES","S/G","ADMINISTRADOR DE INDUSTRIAS","HORAS CLASE","DPTO. TECNOLOGIAS GENERALES",303739
"PROFESOR HORAS CLASES","S/G","ADMINISTRADOR DE INDUSTRIAS","HORAS CLASE","DPTO INGENIERIA EN MINAS",303739
"PROFESOR HORAS CLASES","S/G","PSICOLOGO","HORAS CLASE","ESCUELA DE PSICOLOGIA",130225
"PROFESOR HORAS CLASES","S/G","HORAS CLASE","HORAS CLASE","ESCUELA DE PERIODISMO",509746
"ADMINISTRATIVO","12","ADMINISTRACION DE EMPRESAS. MENCION PERSONAL","ENCARGADO(A) ADM CENTRO_COSTOS","SECRETARIA GENERAL",914127
"PROFESOR HORAS CLASES","S/G","EDUCADORA DE PARVULOS","HORAS CLASE","DEPARTAMENTO DE EDUCACIÓN",132886
"PROFESOR HORAS CLASES","S/G","MAGISTER EN EDUCACION CON MENCION EN ORIENTACION","HORAS CLASE","DEPARTAMENTO DE EDUCACIÓN",227264
"PROFESOR HORAS CLASES","S/G","HORAS CLASE","HORAS CLASE","DEPARTAMENTO DE FISICA",869373
"PROFESOR HORAS CLASES","S/G","MAGISTER EN EDUCACION CON MENCION EN ORIENTACION","HORAS CLASE","DEPARTAMENTO DE EDUCACIÓN",946808
"PROFESOR HORAS CLASES","S/G","MAGISTER EN PROCESAMIENTO Y GESTION DE LA INFORMACION","HORAS CLASE","DPTO INGENIERIA INFORMATICA",418102
"PROFESOR HORAS CLASES","S/G","PERIODISTA","HORAS CLASE","ESCUELA DE PERIODISMO",314326
"PROFESOR HORAS CLASES","S/G","EDUCADORA DE PARVULOS","HORAS CLASE","DEPARTAMENTO DE EDUCACIÓN",509952
"PROFESOR HORAS CLASES","S/G","EDUCADORA DE PARVULOS","HORAS CLASE","DEPARTAMENTO DE EDUCACIÓN",199328
"PROFESIONALES","8","TECNICO UNIVERSITARIO EN ADMINISTRACION DE MATERIALES","CAJERO SON PAGO","FACULTAD DE CIENCIA",2042602
"TECNICO","20","AYUDANTE MAESTRO DE COCINA","AYUDANTE MAESTRO DE COCINA","UNIDAD ADM. SERV. ALIMENTARIOS",689108
"ADMINISTRATIVO","17","TECNOLOGO EN ADMINISTRACION DE PERSONAL","ADMINISTRATIVO DE REGISTRO CUR","FACULTAD DE HUMANIDADES",796344
"PROFESIONALES","14","TECNOLOGO EN ADMINISTRACION DE PERSONAL","ANALISTA EN GESTION ADM.","FACULTAD DE CIENCIA",1398186
"ADMINISTRATIVO","14","ADMINISTRATIVO","ADMINISTRATIVO","DIRECCIÓN DE POSTGRADO",816649
"PROFESOR HORAS CLASES","S/G","MAGISTER EN LETRAS CON MENCION EN LINGUISTICA","HORAS CLASE","DPTO LINGUISTICA Y LITERATURA",1117120
"TECNICO","17","FOTOGRAFIA PUBLICITARIA","FOTOGRAFO","DEPARTAMENTO DE COMUNICACIONES",869044
"PROFESIONALES","9","TECNOLOGO EN CONTROL INDUSTRIAL","ANALISTA DE GESTION DE PERSONA","DEPTO. DESARROLLO DE PERSONAS",1746538
"AUXILIARES","21","AUXILIAR DE SERVICIOS","AUXILIAR DE SERVICIOS","CECTA",853815
"PROFESIONALES","9","MAGISTER EN ECONOMIA FINANCIERA","JEFE DE LABORATORIO","DPTO INGENIERIA OBRAS CIVILES",1796516
"PROFESOR HORAS CLASES","S/G","MAGISTER EN ECONOMIA FINANCIERA","JEFE DE LABORATORIO","DPTO  INGENIERIA INDUSTRIAL",911213
"PROFESOR HORAS CLASES","S/G","HORAS CLASE","HORAS CLASE","FACULTAD DE CIENCIAS MEDICAS",634454
"PROFESOR HORAS CLASES","S/G","ADMINISTRADOR PUBLICO","HORAS CLASE","DPTO. TECNOLOGIAS GENERALES",651062
"PROFESOR HORAS CLASES","S/G","PROFESOR DE EDUCACION MEDIA EN HISTORIA Y GEOGRAFIA","HORAS CLASE","DEPARTAMENTO DE EDUCACIÓN",374828
"PROFESOR HORAS CLASES","S/G","PROFESOR DE EDUCACION MEDIA EN HISTORIA Y GEOGRAFIA","HORAS CLASE","DEPARTAMENTO DE EDUCACIÓN",81938
"TECNICO","20","CHOFER","CHOFER","UNIDAD DE GESTION DEL CAMPUS",731084
"ADMINISTRATIVO","16","SECRETARIADO EJECUTIVO COMPUTACIONAL","SECRETARIA DE APOYO DOCENTE","ESCUELA DE MEDICINA",783832
"ADMINISTRATIVO","17","ANALISTA CONTABLE","ANALISTA CONTABLE","DEPTO. DE FINANZAS Y TESORERIA",892046
"ACADEMICOS","8","ABOGADO(A)","ACADEMICO","FACULTAD DE DERECHO",522642
"PROFESOR HORAS CLASES","S/G","HORAS CLASE","HORAS CLASE","DPTO. GESTION Y POLITICAS PUB.",885093
"ACADEMICOS","6","DOCTOR EN QUIMICA","ACADEMICO","DPTO. QUIMICA DE LOS MATERIALE",2708030
"PROFESOR HORAS CLASES","S/G","HORAS CLASE","HORAS CLASE","DEPTO DE HISTORIA",318032
"ACADEMICOS","4","MEDICO CIRUJANO","ACADEMICO","ESCUELA DE MEDICINA",2427746
"PROFESOR HORAS CLASES","S/G","INGENIERO CIVIL EN OBRAS CIVILES","HORAS CLASE","DPTO INGENIERIA OBRAS CIVILES",761483
"PROFESOR HORAS CLASES","S/G","INGENIERO DE EJECUCION EN GEOMENSURA","HORAS CLASE","DPTO INGENIERIA GEOGRAFICA",406983
"PROFESIONALES","8","INGENIERO DE EJECUCION EN COMPUTACION E INFORMATICA","ANALISTA INFORMATICO","FACULTAD DE INGENIERÍA",1998216
"PROFESOR HORAS CLASES","S/G","PSICOLOGO","HORAS CLASE","ESCUELA DE PSICOLOGIA",211375
"PROFESOR HORAS CLASES","S/G","INGENIERO DE EJECUCION EN CLIMATIZACION","HORAS CLASE","DPTO INGENIERIA MECANICA",60218
"PROFESIONALES","9","INGENIERO DE EJECUCION EN ADMINISTRACION DE EMPRESAS","PROFESIONAL","VR INVEST. DESARR E INNOVACION",1897712
"PROFESOR HORAS CLASES","S/G","MAGISTER EN EDUCACION CON MENCION EN CURRICULUM Y EVALUACION","HORAS CLASE","DEPARTAMENTO DE EDUCACIÓN",545968
"PROFESOR HORAS CLASES","S/G","PROFESOR DE ESTADO EN CASTELLANO","HORAS CLASE","DPTO LINGUISTICA Y LITERATURA",289089
"PROFESOR HORAS CLASES","S/G","HORAS CLASE","HORAS CLASE","ESCUELA DE ARQUITECTURA",225375
"PROFESOR HORAS CLASES","S/G","HORAS CLASE","HORAS CLASE","DPTO MAT. Y CS. DE LA COMP.",390925
"PROFESOR HORAS CLASES","S/G","MAGISTER EN EDUCACION CON MENCION EN CURRICULUM Y EVALUACION","HORAS CLASE","DEPARTAMENTO DE EDUCACIÓN",277970
"PROFESOR HORAS CLASES","S/G","PROFESOR DE ESTADO EN CASTELLANO","HORAS CLASE","DPTO LINGUISTICA Y LITERATURA",569792
"PROFESOR HORAS CLASES","S/G","MAGISTER EN PSICOLOGIA","HORAS CLASE","ESCUELA DE PSICOLOGIA",243977
"ACADEMICOS","6","ENFERMERA","ACADEMICO","ESCUELA DE ENFERMERIA",2640785
"PROFESOR HORAS CLASES","S/G","ANTROPOLOGIA SOCIAL","HORAS CLASE","DEPTO DE HISTORIA",191994
"ADMINISTRATIVO","17","SECRETARIA DE APOYO DOCENTE","SECRETARIA DE APOYO DOCENTE","DPTO LINGUISTICA Y LITERATURA",715835
"PROFESIONALES","8","SOCIOLOGO","COORDINADOR DE PROYECTOS","CENTRO DE INTEGR ING SOCIEDAD",1804024
"PROFESOR HORAS CLASES","S/G","DOCTOR EN EDUCACION FISICA","HORAS CLASE","CARRERA LICEN CS. ACTIV. FISIC",855010
"PROFESOR HORAS CLASES","S/G","INGENIERO(A) DE EJECUCION EN ELECTRICIDAD","HORAS CLASE","DPTO. TECNOLOGIAS INDUSTRIALES",1287973
"PROFESOR HORAS CLASES","S/G","HORAS CLASE","HORAS CLASE","DPTO MAT. Y CS. DE LA COMP.",261026
"PROFESOR HORAS CLASES","S/G","HORAS CLASE","HORAS CLASE","DPTO MAT. Y CS. DE LA COMP.",875079
"PROFESOR HORAS CLASES","S/G","INGENIERO COMERCIAL EN ECONOMIA","HORAS CLASE","DPTO DE ECONOMIA",480021
"TECNICO","17","TECNICO","TECNICO","UNIDAD DE GESTION DEL CAMPUS",727336
"AUXILIARES","21","AUXILIAR DE SERVICIOS","AUXILIAR DE SERVICIOS","VR. DE APOYO AL ESTUDIANTE",877281
"PROFESIONALES","13","DIRECTOR CORO USACH","DIRECTOR CORO USACH","DEPARTAMENTO DE EXTENSION",1287219
"PROFESIONALES","14","TECNOLOGO EN CONTROL INDUSTRIAL","ANALISTA","UNIDAD DE ADQUISICIONES",1233105
"ADMINISTRATIVO","16","ADMINISTRATIVO CONTABLE","ADMINISTRATIVO CONTABLE","ADM.GRAL. FONDO SOLIDARIO CRED",807649
"ACADEMICOS","4","DOCTOR EN ESTUDIOS SOCIALES DE LA CIENCIA Y LA TECNOLOGIA","ACADEMICO","INSTITUTO DE ESTUDIOS AVANZADO",3170986
"PROFESOR HORAS CLASES","S/G","INGENIERO CIVIL DE INDUSTRIAL","HORAS CLASE","DPTO  INGENIERIA INDUSTRIAL",684954
"PROFESOR HORAS CLASES","S/G","PROFESOR DE MATEMATICAS","HORAS CLASE","DPTO MAT. Y CS. DE LA COMP.",1325940
"PROFESOR HORAS CLASES","S/G","DOCTOR EN MEDICINA Y CIRUGIA","HORAS CLASE","ESCUELA DE MEDICINA",465845
"PROFESOR HORAS CLASES","S/G","MATRON (A)","ACADEMICO","ESCUELA DE OBST Y PUERICULTURA",442158
"ACADEMICOS","6","MATRON (A)","ACADEMICO","VICERRECTORIA ACADÉMICA",1368818
"ACADEMICOS","6","DOCTOR EN CIENCIAS APLICADAS EN LA OPCION DE NANOCIENCIAS Y NANOTECNOLOGIAS","ACADEMICO","DEPARTAMENTO DE FISICA",2689950
"PROFESOR HORAS CLASES","S/G","PROFESOR DE ESTADO EN MATEMATICA Y COMPUTACION","HORAS CLASE","DPTO MAT. Y CS. DE LA COMP.",1098137
"ACADEMICOS","6","DOCTOR EN FÍSICA","ACADEMICO","DEPARTAMENTO DE FISICA",2726109
"ADMINISTRATIVO","12","SECRETARIA ADMINISTRATIVA","SECRETARIA ADMINISTRATIVA","DPTO  INGENIERIA INDUSTRIAL",928253
"ACADEMICOS","6","DOCTOR EN FARMACOLOGIA","ACADEMICO","DPTO. DE INVEST. CIENTIFICA",2653790
"PROFESOR HORAS CLASES","S/G","HORAS CLASE","HORAS CLASE","DPTO INGENIERIA EN MINAS",283445
"PROFESOR HORAS CLASES","S/G","PSICOLOGO","HORAS CLASE","ESCUELA DE ENFERMERIA",292891
"PROFESOR HORAS CLASES","S/G","PSICOLOGO","HORAS CLASE","UNIDAD PROMOCIÓN DE LA SALUD",163698
"PROFESOR HORAS CLASES","S/G","INGENIERO DE EJECUCION EN GEOMENSURA","HORAS CLASE","DPTO INGENIERIA GEOGRAFICA",180491
"PROFESOR HORAS CLASES","S/G","INGENIERO CIVIL","HORAS CLASE","DPTO  INGENIERIA INDUSTRIAL",130225
"ACADEMICOS","6","PSICOLOGO","DIRECTOR ESCUELA DE PSICOLOGIA","ESCUELA DE PSICOLOGIA",4205164
"PROFESIONALES","9","PROFESOR DE INGLES","JEFE DE SECCION","DPTO LINGUISTICA Y LITERATURA",1746538
"ADMINISTRATIVO","13","SECRETARIA DE DECANATO","SECRETARIA DE DECANATO","DPTO CONTABILIDAD Y AUDITOR",960017
"PROFESIONALES","12","RELACIONADOR PUBLICO","RELACIONADOR PUBLICO","DEPARTAMENTO DE COMUNICACIONES",1450607
"PROFESOR HORAS CLASES","S/G","PROFESOR DE INGLES","JEFE DE SECCION","DPTO LINGUISTICA Y LITERATURA",415103
"PROFESOR HORAS CLASES","S/G","MASTER EN DIRECCION DE ADMINISTRACION Y FINANZAS","HORAS CLASE","DPTO DE ADMINISTRACION",391536
"PROFESOR HORAS CLASES","S/G","MASTER EN DIRECCION DE ADMINISTRACION Y FINANZAS","HORAS CLASE","DPTO DE ADMINISTRACION",744567
"PROFESIONALES","13","BIBLIOTECOLOGO CON MENCION EN AUTOMATIZACION DE UNIDADES DE INFORMACION","ENCARGADO DE ARCHIVO CENTRAL","SECRETARIA GENERAL",1313880
"ACADEMICOS","6","ABOGADO(A)","ACADEMICO","FACULTAD DE DERECHO",636049
"PROFESOR HORAS CLASES","S/G","INGENIERO CIVIL MECANICO","HORAS CLASE","DPTO. TECNOLOGIAS INDUSTRIALES",1428220
"PROFESOR HORAS CLASES","S/G","INGENIERO CIVIL MECANICO","HORAS CLASE","DPTO. TECNOLOGIAS INDUSTRIALES",445407
"ACADEMICOS","6","ACADEMICO","ACADEMICO","DPTO. DE INVEST. CIENTIFICA",2617631
"ACADEMICOS","4","MAGISTER EN CIENCIAS MENCION COMPUTACION","ACADEMICO","DPTO MAT. Y CS. DE LA COMP.",3339876
"PROFESOR HORAS CLASES","S/G","HORAS CLASE","HORAS CLASE","UNIDAD PROMOCIÓN DE LA SALUD",471575
"PROFESOR HORAS CLASES","S/G","MAGISTER EN PEDAGOGIA UNIVERSITARIA","HORAS CLASE","DEPARTAMENTO DE BIOLOGIA",562379
"ACADEMICOS","4","MAGISTER EN HISTORIA","ACADEMICO","DPTO. GESTION Y POLITICAS PUB.",3128763
"PROFESIONALES","13","DOCTOR EN BIOTECNOLOGIA","HORAS CLASE","UNIDAD DE COORDINACIÓN INSTIT.",946966
"PROFESOR HORAS CLASES","S/G","DOCTOR EN BIOTECNOLOGIA","HORAS CLASE","DPTO. QUIMICA DE LOS MATERIALE",623546
"PROFESOR HORAS CLASES","S/G","MAGISTER EN ARTES. CON MENCION EN TEORIA E HISTORIA DEL ARTE","HORAS CLASE","DPTO. TECNOLOGIAS GENERALES",736488
"PROFESOR HORAS CLASES","S/G","DOCTOR EN BIOTECNOLOGIA","HORAS CLASE","DPTO. QUIMICA DE LOS MATERIALE",531541
"PROFESIONALES","6","MAGISTER EN PSICOLOGIA SOCIAL APLICADA","ANALISTA DE PROYECTOS I","DPTO  INGENIERIA INDUSTRIAL",2239773
"ADMINISTRATIVO","10","ADM ESPECIALIZADO EN PEOPLESOF","ADM ESPECIALIZADO EN PEOPLESOF","UNIDAD DESARR. PROYECTOS TECN.",996786
"PROFESOR HORAS CLASES","S/G","MAGISTER EN PSICOLOGIA SOCIAL APLICADA","ANALISTA DE PROYECTOS I","DPTO  INGENIERIA INDUSTRIAL",211257
